_id,name,logo,category,used,details,reviews,expires_on,type,location,code
500,Blogpad,image/gif,Mobiles & Tablets,3,Duis at velit eu est congue elementum. In hac habitasse platea dictumst.,2,24/09/2018,Rs.400 Cash Off,Teni,X7778:AXFBWB
501,Zooxo,image/png,Food & Dining,61,"Donec diam neque, vestibulum eget, vulputate ut, ultrices vel, augue. Vestibulum ante ipsum primis in faucibus orci luctus et ultrices posuere cubilia Curae; Donec pharetra, magna vestibulum aliquet ultrices, erat tortor sollicitudin mi, sit amet lobortis sapien sapien non mi.",3,14/09/2018,Rs.500 Cash Off,Navi Mumbai,B7869:2UNT5L
502,Tekfly,image/pjpeg,Home Furnishing & Decor,6,In hac habitasse platea dictumst.,4,05/10/2018,Rs.60 Cash Off,Jaipur,V4397:D5DXML
503,Photolist,image/tiff,Food & Dining,70,Aliquam non mauris.,1,25/10/2018,FREE,Patna,X0067:G3JOBK
504,Youspan,image/gif,TV/Audio/Video & Movies,98,Quisque id justo sit amet sapien dignissim vestibulum.,0,27/10/2018,Rs.400 Cashback,Kanpur,C7769:IQRZPQ
505,Quatz,image/gif,Food & Dining,8,Maecenas rhoncus aliquam lacus. Morbi quis tortor id nulla ultrices aliquet.,4,27/10/2018,Rs.500 Cash Off,Ludhiana,N7197:WMTHTO
506,Skalith,image/gif,Fashion,63,"Maecenas tristique, est et tempus semper, est quam pharetra magna, ac consequat metus sapien ut nunc.",5,23/10/2018,Rs.500 Cash Off,Shivaji Nagar,O1662:KXI7I3
507,Vipe,image/png,Entertainment,28,Proin interdum mauris non ligula pellentesque ultrices.,3,01/10/2018,Rs.300 Cash Off,Thane,A2454:02CINA
508,Oodoo,image/gif,Fashion,55,Pellentesque at nulla.,3,28/10/2018,Rs.300 Cash Off,Nashik,I8713:CZKW1G
509,Blognation,image/x-tiff,Recharge,88,Fusce consequat. Nulla nisl.,0,30/09/2018,Rs.40 Cash Off,Dombivli,X9762:RBC42L
510,Myworks,image/jpeg,Mobiles & Tablets,23,Integer a nibh.,4,12/09/2018,Rs.70 Cash Off,Bhopal,U4338:QV7446
511,Tagcat,image/tiff,Mobiles & Tablets,29,Proin risus. Praesent lectus.,3,27/10/2018,10% Discount,Hyderabad,I5054:DPFV73
512,Topicware,image/tiff,TV/Audio/Video & Movies,59,"Quisque porta volutpat erat. Quisque erat eros, viverra eget, congue eget, semper rutrum, nulla.",2,14/10/2018,30% Discount,Ahmedabad,W1106:HWDP76
513,Zoonder,image/jpeg,Entertainment,32,Duis mattis egestas metus. Aenean fermentum.,3,19/09/2018,Rs.80 Cash Off,Ludhiana,F8428:DJ9ENM
514,Quire,image/tiff,Entertainment,67,Etiam justo. Etiam pretium iaculis justo.,5,23/09/2018,Rs.80 Cash Off,Pune,W9497:3KXIN4
515,Zava,image/jpeg,Mobiles & Tablets,79,"Morbi odio odio, elementum eu, interdum eu, tincidunt in, leo.",5,15/10/2018,Rs.60 Cash Off,Tirunelveli,D4000:BJ6N1H
516,Brainsphere,image/jpeg,Entertainment,93,Donec quis orci eget orci vehicula condimentum.,0,27/09/2018,Rs.40 Cash Off,Coimbatore,W1205:04G016
517,Einti,image/tiff,Mobiles & Tablets,67,Donec quis orci eget orci vehicula condimentum.,5,18/10/2018,90% Discount,Madurai,F8934:UFZR3S
518,Yamia,image/jpeg,Food & Dining,7,"Vestibulum ante ipsum primis in faucibus orci luctus et ultrices posuere cubilia Curae; Donec pharetra, magna vestibulum aliquet ultrices, erat tortor sollicitudin mi, sit amet lobortis sapien sapien non mi. Integer ac neque.",4,21/09/2018,Rs.200 Cash Off,Gwalior,B3609:8P58NZ
519,Yakidoo,image/jpeg,TV/Audio/Video & Movies,11,Nam nulla.,5,25/10/2018,Rs.500 Cash Off,Ghaziabad,L2124:6WPDAY
520,Demimbu,image/png,Mobiles & Tablets,8,Vestibulum sed magna at nunc commodo placerat. Praesent blandit.,0,07/10/2018,Rs.90 Cash Off,Jaipur,H1052:WK7WTL
521,Ntag,image/gif,Laptops & Gaming,17,Integer tincidunt ante vel ipsum. Praesent blandit lacinia erat.,1,04/10/2018,Rs.90 Cash Off,Visakhapatnam,E0752:IX5378
522,Gigashots,image/jpeg,Entertainment,63,Mauris ullamcorper purus sit amet nulla.,2,22/10/2018,Rs.300 Cashback,Haora,L3690:YXMZVB
523,Yakidoo,image/gif,Fashion,35,In hac habitasse platea dictumst.,5,24/10/2018,60% Discount,Patna,E2841:OPX7IE
524,Twitterlist,image/gif,Fashion,51,Nulla tempus. Vivamus in felis eu sapien cursus vestibulum.,1,29/10/2018,30% Discount,Jaipur,K3998:1CCOEJ
525,Oodoo,image/pjpeg,TV/Audio/Video & Movies,18,Maecenas ut massa quis augue luctus tincidunt.,2,16/09/2018,20% Discount,Ghaziabad,J8149:2T7MNZ
526,Edgeify,image/x-tiff,Mobiles & Tablets,51,Vestibulum ac est lacinia nisi venenatis tristique.,5,12/09/2018,50% Discount,Allahabad,C9625:FF7RPE
527,Oozz,image/pjpeg,Home Furnishing & Decor,86,"Donec odio justo, sollicitudin ut, suscipit a, feugiat et, eros. Vestibulum ac est lacinia nisi venenatis tristique.",0,06/10/2018,Rs.100 Cash Off,Visakhapatnam,P4316:T4S8Z1
528,Skipstorm,image/x-tiff,Home Furnishing & Decor,39,Suspendisse potenti.,5,10/10/2018,Rs.100 Cashback,Lucknow,S3913:3MR7EO
529,Skippad,image/gif,Beauty & Health,43,Phasellus in felis.,0,08/10/2018,Rs.100 Cash Off,Jodhpur,W1183:WS240E
530,Voolith,image/gif,Beauty & Health,94,"Lorem ipsum dolor sit amet, consectetuer adipiscing elit. Proin interdum mauris non ligula pellentesque ultrices.",1,11/10/2018,Rs.80 Cash Off,Thane,L1399:L5M71V
531,Zoonoodle,image/jpeg,Food & Dining,88,"Cras mi pede, malesuada in, imperdiet et, commodo vulputate, justo.",1,25/10/2018,Rs.100 Cash Off,Solapur,G7648:ODDTUZ
532,Flipstorm,image/x-tiff,Home Furnishing & Decor,2,"Phasellus id sapien in sapien iaculis congue. Vivamus metus arcu, adipiscing molestie, hendrerit at, vulputate vitae, nisl.",3,15/10/2018,Rs.40 Cash Off,Rajkot,O4059:GBTOPO
533,Livetube,image/x-tiff,Fashion,38,Vivamus tortor.,3,04/10/2018,90% Discount,Vadodara,T6410:LIUB2Q
534,Yabox,image/tiff,Beauty & Health,100,Suspendisse potenti.,2,27/09/2018,Rs.90 Cash Off,Faridabad,K2409:31CGI4
535,Yakitri,image/png,TV/Audio/Video & Movies,18,Nulla justo. Aliquam quis turpis eget elit sodales scelerisque.,0,12/09/2018,10% Discount,Nashik,K5969:WBNT2I
536,Topiclounge,image/png,Recharge,54,Pellentesque at nulla.,1,28/09/2018,Rs.20 Cash Off,Kalyan,M7080:PA6Y1V
537,Yamia,image/pjpeg,TV/Audio/Video & Movies,64,"Nam dui. Proin leo odio, porttitor id, consequat in, consequat ut, nulla.",1,27/09/2018,10% Discount,Kalyan,O0693:MT0L39
538,Blogtags,image/x-tiff,Laptops & Gaming,58,"Fusce congue, diam id ornare imperdiet, sapien urna pretium nisl, ut volutpat sapien arcu sed augue.",0,24/09/2018,30% Discount,Patna,H4617:T4AP6L
539,Gevee,image/tiff,Fashion,39,"Nunc nisl. Duis bibendum, felis sed interdum venenatis, turpis enim blandit mi, in porttitor pede justo eu massa.",1,21/09/2018,Rs.300 Cash Off,Ghaziabad,Y2590:S68AO4
540,Lazzy,image/gif,Entertainment,32,Nulla mollis molestie lorem. Quisque ut erat.,2,29/10/2018,60% Discount,Dombivli,V4697:AJVEPX
541,Yoveo,image/pjpeg,Entertainment,84,"Vestibulum ante ipsum primis in faucibus orci luctus et ultrices posuere cubilia Curae; Donec pharetra, magna vestibulum aliquet ultrices, erat tortor sollicitudin mi, sit amet lobortis sapien sapien non mi.",4,30/10/2018,Rs.10 Cash Off,Nowrangapur,H8733:UETIMW
542,Jaxnation,image/jpeg,Beauty & Health,51,Vestibulum rutrum rutrum neque.,2,02/10/2018,Rs.200 Cash Off,Kolkata,J4299:6GF02M
543,Jazzy,image/pjpeg,Food & Dining,24,"Cras pellentesque volutpat dui. Maecenas tristique, est et tempus semper, est quam pharetra magna, ac consequat metus sapien ut nunc.",0,23/09/2018,Rs.90 Cash Off,Bengaluru,R2166:SO7QT9
544,Zoonoodle,image/tiff,Laptops & Gaming,57,"Aliquam augue quam, sollicitudin vitae, consectetuer eget, rutrum at, lorem. Integer tincidunt ante vel ipsum.",3,07/10/2018,Rs.10 Cash Off,Varanasi,O0153:UTQ6GX
545,Fivechat,image/jpeg,Laptops & Gaming,98,Maecenas pulvinar lobortis est.,0,14/09/2018,80% Discount,Delhi,W8405:EPL7DI
546,Eare,image/png,Home Furnishing & Decor,13,"Donec odio justo, sollicitudin ut, suscipit a, feugiat et, eros.",2,23/10/2018,Rs.500 Cashback,Vijayawada,Z0028:4D09OT
547,Kazu,image/tiff,Home Furnishing & Decor,65,Etiam justo. Etiam pretium iaculis justo.,0,21/09/2018,Rs.70 Cash Off,Varanasi,U2371:AO4EVL
548,Mybuzz,image/pjpeg,Beauty & Health,74,Phasellus id sapien in sapien iaculis congue.,1,23/10/2018,60% Discount,Haora,E9633:UHG4CU
549,Kazio,image/png,Beauty & Health,68,Maecenas ut massa quis augue luctus tincidunt.,2,17/09/2018,Rs.60 Cash Off,Gorakhpur,E5392:M7SMOR
550,Katz,image/jpeg,Mobiles & Tablets,26,"Morbi odio odio, elementum eu, interdum eu, tincidunt in, leo.",2,29/09/2018,80% Discount,Kanpur,E9580:SS36Z0
551,Youtags,image/tiff,Home Furnishing & Decor,14,Mauris sit amet eros.,2,22/09/2018,Rs.200 Cash Off,Coimbatore,T9761:CR4JZK
552,Nlounge,image/png,Entertainment,90,Nullam varius.,3,02/10/2018,Rs.20 Cash Off,Pune,S7689:X25K9Y
553,Oyondu,image/tiff,TV/Audio/Video & Movies,94,Duis aliquam convallis nunc. Proin at turpis a pede posuere nonummy.,2,01/10/2018,Rs.90 Cash Off,Srinagar,U6259:WMPRAT
554,Fanoodle,image/pjpeg,Fashion,60,"Lorem ipsum dolor sit amet, consectetuer adipiscing elit. Proin risus.",3,25/10/2018,Rs.60 Cash Off,Pune,K2208:QFLRBE
555,Chatterbridge,image/pjpeg,Beauty & Health,100,Nulla nisl. Nunc nisl.,0,05/10/2018,Rs.400 Cashback,Guwahati,R1843:QFB07Y
556,Meevee,image/jpeg,Recharge,31,Ut at dolor quis odio consequat varius.,5,24/09/2018,Rs.20 Cash Off,Nagpur,N6772:YZ90UX
557,Browsecat,image/x-tiff,Mobiles & Tablets,10,Aenean fermentum. Donec ut mauris eget massa tempor convallis.,3,28/10/2018,Rs.80 Cash Off,Agra,W2021:45XWP7
558,Dynabox,image/tiff,Fashion,22,"Quisque arcu libero, rutrum ac, lobortis vel, dapibus at, diam.",1,13/10/2018,Rs.10 Cash Off,Indore,G3823:FQDNEJ
559,Tazz,image/tiff,Entertainment,58,"Aliquam sit amet diam in magna bibendum imperdiet. Nullam orci pede, venenatis non, sodales sed, tincidunt eu, felis.",4,14/09/2018,80% Discount,Varanasi,Y4211:1OP1RM
560,Bubblemix,image/png,Laptops & Gaming,17,Maecenas pulvinar lobortis est. Phasellus sit amet erat.,2,11/10/2018,30% Discount,Coimbatore,T6879:2RL5DX
561,Realbridge,image/x-tiff,Food & Dining,76,"Lorem ipsum dolor sit amet, consectetuer adipiscing elit. Proin interdum mauris non ligula pellentesque ultrices.",5,25/09/2018,40% Discount,Chandigarh,X2696:47Z5XQ
562,Skyba,image/tiff,Computers,55,Quisque ut erat. Curabitur gravida nisi at nibh.,5,25/09/2018,Rs.30 Cash Off,Chennai,R5700:ZUEMFC
563,Devpoint,image/pjpeg,Mobiles & Tablets,48,Curabitur convallis. Duis consequat dui nec nisi volutpat eleifend.,5,29/09/2018,Rs.50 Cash Off,Shivaji Nagar,J8315:0Y5MQ2
564,Jaxworks,image/x-tiff,Home Furnishing & Decor,14,Phasellus in felis. Donec semper sapien a libero.,3,25/10/2018,Rs.200 Cashback,Ghaziabad,I3045:41RESY
565,Jatri,image/gif,Food & Dining,58,Morbi non lectus. Aliquam sit amet diam in magna bibendum imperdiet.,5,27/10/2018,Rs.60 Cash Off,Chandigarh,T5815:O5QRN2
566,Skilith,image/tiff,TV/Audio/Video & Movies,77,Maecenas tincidunt lacus at velit.,1,23/09/2018,Rs.60 Cash Off,Thane,E1369:N5KY7K
567,Topiclounge,image/gif,Home Furnishing & Decor,90,Suspendisse potenti. Cras in purus eu magna vulputate luctus.,1,08/10/2018,Rs.400 Cashback,Kolkata,N1003:AG82ZZ
568,Kaymbo,image/pjpeg,Home Furnishing & Decor,93,"Morbi ut odio. Cras mi pede, malesuada in, imperdiet et, commodo vulputate, justo.",5,28/09/2018,60% Discount,Vadodara,S9539:ND32U1
569,Centizu,image/tiff,Recharge,64,Integer a nibh.,0,29/09/2018,Rs.50 Cashback,Haora,B6644:X9SF1L
570,Zoovu,image/jpeg,TV/Audio/Video & Movies,9,Vivamus vel nulla eget eros elementum pellentesque.,3,14/10/2018,30% Discount,Tirunelveli,P8548:Q8DFT2
571,Bubblebox,image/x-tiff,Home Furnishing & Decor,67,Nulla facilisi. Cras non velit nec nisi vulputate nonummy.,3,06/10/2018,FREE,Haora,F3667:QGOEOW
572,Dabshots,image/gif,Home Furnishing & Decor,47,Maecenas pulvinar lobortis est. Phasellus sit amet erat.,5,07/10/2018,Rs.30 Cash Off,Agra,A2474:KSOI87
573,Voomm,image/gif,Entertainment,72,Duis ac nibh.,3,24/10/2018,Rs.80 Cash Off,Nagpur,N4484:Z2PPNS
574,Zooxo,image/tiff,Recharge,33,Vivamus tortor. Duis mattis egestas metus.,3,02/10/2018,Rs.80 Cash Off,Kolkata,S5553:4G19CW
575,Fliptune,image/jpeg,Beauty & Health,19,Suspendisse accumsan tortor quis turpis.,3,27/09/2018,40% Discount,Gwalior,M6173:XVOZFF
576,Topiczoom,image/pjpeg,Recharge,54,"Maecenas tristique, est et tempus semper, est quam pharetra magna, ac consequat metus sapien ut nunc.",2,16/10/2018,30% Discount,Guwahati,V0004:59O8DS
577,Meemm,image/tiff,Entertainment,41,Nunc rhoncus dui vel sem.,2,10/10/2018,90% Discount,Faridabad,L6495:8DUG51
578,Jayo,image/tiff,Fashion,10,"Cum sociis natoque penatibus et magnis dis parturient montes, nascetur ridiculus mus. Etiam vel augue.",5,11/10/2018,80% Discount,Ghaziabad,Z7558:RG6166
579,Dabtype,image/jpeg,Mobiles & Tablets,88,Duis bibendum.,0,05/10/2018,Rs.10 Cash Off,Surat,B7612:0O5QB7
580,Tekfly,image/tiff,Entertainment,89,In hac habitasse platea dictumst.,3,29/09/2018,Rs.60 Cash Off,Ludhiana,Z3342:JCGSHX
581,Shuffledrive,image/pjpeg,Mobiles & Tablets,86,Suspendisse potenti. Nullam porttitor lacus at turpis.,5,04/10/2018,60% Discount,Nagpur,F9759:AVOA61
582,Bubbletube,image/x-tiff,Mobiles & Tablets,84,Nam nulla.,1,07/10/2018,Rs.400 Cash Off,Nagpur,I1662:T2Z2XU
583,Feedspan,image/png,Food & Dining,10,"In hac habitasse platea dictumst. Morbi vestibulum, velit id pretium iaculis, diam erat fermentum justo, nec condimentum neque sapien placerat ante.",4,22/10/2018,Rs.200 Cashback,Allahabad,X0837:VV7R1U
584,Yakijo,image/gif,Laptops & Gaming,98,Fusce consequat. Nulla nisl.,5,18/09/2018,40% Discount,Nowrangapur,E2166:4X6MFE
585,Topicshots,image/jpeg,Computers,11,"Donec vitae nisi. Nam ultrices, libero non mattis pulvinar, nulla pede ullamcorper augue, a suscipit nulla elit ac nulla.",1,01/10/2018,10% Discount,Gwalior,B0026:PLLOKB
586,Divavu,image/x-tiff,Entertainment,71,In quis justo.,5,11/10/2018,40% Discount,Dombivli,Y2466:W7SZDV
587,Jaxworks,image/jpeg,Computers,53,Donec ut mauris eget massa tempor convallis.,4,03/10/2018,Rs.300 Cashback,Thane,M9767:K1Z1C9
588,Yadel,image/jpeg,Home Furnishing & Decor,56,"Suspendisse ornare consequat lectus. In est risus, auctor sed, tristique in, tempus sit amet, sem.",5,12/09/2018,90% Discount,Dombivli,P2924:7WZS5A
589,Yadel,image/pjpeg,Fashion,53,In hac habitasse platea dictumst.,3,03/10/2018,Rs.400 Cashback,Dombivli,L8639:6GY6AT
590,Jayo,image/tiff,Laptops & Gaming,89,Fusce consequat. Nulla nisl.,1,09/10/2018,Rs.60 Cash Off,Kalyan,H2376:GM8KKM
591,Voolith,image/x-tiff,Fashion,40,In hac habitasse platea dictumst. Maecenas ut massa quis augue luctus tincidunt.,5,19/10/2018,Rs.30 Cash Off,Meerut,N4796:BAR4WB
592,Gabtype,image/gif,Food & Dining,57,Nunc purus.,4,12/10/2018,Rs.400 Cashback,Kolkata,X7831:TOQW3O
593,Vipe,image/png,Mobiles & Tablets,19,Fusce posuere felis sed lacus.,5,16/10/2018,Rs.300 Cash Off,Meerut,L9665:1S4325
594,Realbuzz,image/x-tiff,Entertainment,54,"Vestibulum ante ipsum primis in faucibus orci luctus et ultrices posuere cubilia Curae; Donec pharetra, magna vestibulum aliquet ultrices, erat tortor sollicitudin mi, sit amet lobortis sapien sapien non mi.",4,12/09/2018,FREE,Rajkot,Y7193:GCUDBN
595,Buzzster,image/jpeg,Laptops & Gaming,27,"Vivamus vestibulum sagittis sapien. Cum sociis natoque penatibus et magnis dis parturient montes, nascetur ridiculus mus.",4,03/10/2018,70% Discount,Patna,O7800:J466J3
596,Realcube,image/x-tiff,TV/Audio/Video & Movies,77,In congue. Etiam justo.,3,29/10/2018,FREE,Pimpri,S6251:QKR1MG
597,Rhyzio,image/jpeg,Recharge,81,Proin at turpis a pede posuere nonummy. Integer non velit.,1,09/10/2018,Rs.70 Cash Off,Thane,Y7973:YPK9WR
598,Kwideo,image/pjpeg,Laptops & Gaming,90,Phasellus sit amet erat. Nulla tempus.,1,13/09/2018,Rs.60 Cash Off,Chandigarh,Z2182:Y3K91R
599,Camido,image/png,Entertainment,81,Suspendisse potenti.,5,04/10/2018,20% Discount,Kolkata,J8443:3YENUI
600,Thoughtbeat,image/jpeg,Beauty & Health,20,Integer ac neque.,2,13/09/2018,Rs.300 Cash Off,Madurai,T1490:66G2J5
601,Kaymbo,image/gif,Food & Dining,24,Etiam justo. Etiam pretium iaculis justo.,5,19/09/2018,Rs.400 Cash Off,Solapur,P5423:FSGSN4
602,Gabcube,image/gif,Recharge,32,"Mauris enim leo, rhoncus sed, vestibulum sit amet, cursus id, turpis.",5,06/10/2018,60% Discount,Jabalpur,C7607:XBIEZD
603,Zoonoodle,image/x-tiff,Laptops & Gaming,60,Praesent id massa id nisl venenatis lacinia.,4,09/10/2018,Rs.100 Cashback,Visakhapatnam,X3382:EW3FB2
604,Linklinks,image/x-tiff,Entertainment,90,"Vestibulum ante ipsum primis in faucibus orci luctus et ultrices posuere cubilia Curae; Nulla dapibus dolor vel est. Donec odio justo, sollicitudin ut, suscipit a, feugiat et, eros.",3,25/09/2018,Rs.80 Cash Off,Aurangabad,C7952:MEL1BY
605,Realmix,image/tiff,Beauty & Health,29,Cras non velit nec nisi vulputate nonummy.,1,11/10/2018,Rs.10 Cash Off,Varanasi,P4266:JTFFLQ
606,Vinder,image/tiff,Laptops & Gaming,61,Praesent blandit.,2,15/09/2018,30% Discount,Madurai,M4528:K9Q4PA
607,Gabvine,image/x-tiff,Fashion,46,"Cras mi pede, malesuada in, imperdiet et, commodo vulputate, justo.",4,17/09/2018,Rs.300 Cashback,Guwahati,J2616:90DHGI
608,Tekfly,image/x-tiff,Laptops & Gaming,51,Sed ante. Vivamus tortor.,4,10/10/2018,Rs.100 Cash Off,Bhopal,C9308:RBGLO4
609,Kwimbee,image/gif,Beauty & Health,12,Vestibulum sed magna at nunc commodo placerat. Praesent blandit.,1,19/10/2018,Rs.400 Cash Off,Agra,P1140:4UWJ2X
610,Podcat,image/pjpeg,Fashion,27,Praesent blandit.,4,16/09/2018,Rs.70 Cash Off,Pimpri,Z4779:5MXQM2
611,Devpoint,image/jpeg,Recharge,91,"Fusce lacus purus, aliquet at, feugiat non, pretium quis, lectus.",5,05/10/2018,Rs.30 Cash Off,Ludhiana,E8666:C99KU4
612,Viva,image/pjpeg,Fashion,8,Maecenas rhoncus aliquam lacus.,3,22/10/2018,70% Discount,Madurai,F2815:FNKRT1
613,Skynoodle,image/x-tiff,Computers,23,Aenean fermentum. Donec ut mauris eget massa tempor convallis.,5,30/10/2018,Rs.10 Cash Off,Ahmedabad,Q5118:GZDQKB
614,Thoughtblab,image/png,Mobiles & Tablets,99,Aenean fermentum.,1,21/10/2018,40% Discount,Gorakhpur,I5284:E6U851
615,Yotz,image/png,TV/Audio/Video & Movies,5,Suspendisse accumsan tortor quis turpis.,0,19/09/2018,Rs.400 Cash Off,Gorakhpur,B4233:1B2KMQ
616,Tazz,image/tiff,Recharge,16,Suspendisse potenti. Cras in purus eu magna vulputate luctus.,4,28/09/2018,Rs.70 Cash Off,Thane,P8815:7X6D1Z
617,Agimba,image/jpeg,Computers,91,Donec ut dolor. Morbi vel lectus in quam fringilla rhoncus.,3,30/10/2018,Rs.300 Cashback,Kolkata,Y1634:9RH3QJ
618,Devify,image/tiff,TV/Audio/Video & Movies,75,Suspendisse potenti. Cras in purus eu magna vulputate luctus.,5,15/10/2018,FREE,Aurangabad,Q4001:BBA5D9
619,Voonix,image/x-tiff,Laptops & Gaming,48,Nullam varius. Nulla facilisi.,1,25/09/2018,Rs.100 Cash Off,Lucknow,L2996:F2COVZ
620,Zoombeat,image/gif,Laptops & Gaming,16,Nullam molestie nibh in lectus. Pellentesque at nulla.,5,26/09/2018,FREE,Mumbai,L7357:N82EPM
621,Rhybox,image/jpeg,Beauty & Health,50,Aenean sit amet justo.,1,24/09/2018,Rs.80 Cash Off,Jodhpur,H9212:Z4VZB3
622,Voomm,image/pjpeg,Fashion,74,Duis mattis egestas metus. Aenean fermentum.,4,14/09/2018,Rs.10 Cash Off,Kanpur,B1869:JZZ7O2
623,Mudo,image/tiff,Beauty & Health,5,"In blandit ultrices enim. Lorem ipsum dolor sit amet, consectetuer adipiscing elit.",0,02/10/2018,Rs.10 Cash Off,Patna,D3825:PO81Q7
624,Avamm,image/png,Recharge,83,Vivamus tortor. Duis mattis egestas metus.,4,05/10/2018,20% Discount,Kanpur,C1854:CABFA3
625,Trudoo,image/pjpeg,TV/Audio/Video & Movies,93,Quisque porta volutpat erat.,1,22/10/2018,Rs.300 Cashback,Nowrangapur,X8622:DS3XLV
626,Linklinks,image/jpeg,TV/Audio/Video & Movies,57,Sed sagittis.,5,17/09/2018,20% Discount,Jabalpur,N5211:30HHHC
627,Pixope,image/gif,Mobiles & Tablets,73,Quisque ut erat. Curabitur gravida nisi at nibh.,2,22/09/2018,80% Discount,Ahmedabad,T9396:UFWF81
628,Katz,image/pjpeg,Beauty & Health,33,Curabitur convallis.,5,18/10/2018,Rs.50 Cash Off,Patna,K5018:9N5M5W
629,Quire,image/gif,Mobiles & Tablets,3,Integer tincidunt ante vel ipsum. Praesent blandit lacinia erat.,1,25/09/2018,50% Discount,Faridabad,X8066:8WAXOX
630,Zooveo,image/jpeg,Beauty & Health,34,"Integer non velit. Donec diam neque, vestibulum eget, vulputate ut, ultrices vel, augue.",4,25/10/2018,60% Discount,Kanpur,Z2837:3I6P70
631,Jazzy,image/tiff,Food & Dining,7,Praesent id massa id nisl venenatis lacinia.,0,06/10/2018,Rs.200 Cash Off,Visakhapatnam,O7193:G305HS
632,Eidel,image/png,Home Furnishing & Decor,9,Quisque ut erat. Curabitur gravida nisi at nibh.,4,26/09/2018,Rs.500 Cash Off,Gorakhpur,T5107:XL9Q13
633,Devshare,image/gif,Recharge,18,Donec quis orci eget orci vehicula condimentum. Curabitur in libero ut massa volutpat convallis.,3,25/10/2018,Rs.60 Cash Off,Ahmedabad,O2029:L6ODGG
634,Skilith,image/tiff,Recharge,1,Sed accumsan felis.,2,21/09/2018,90% Discount,Faridabad,O6442:T3FLDJ
635,Rhyzio,image/x-tiff,Fashion,29,Maecenas pulvinar lobortis est. Phasellus sit amet erat.,1,12/09/2018,70% Discount,Ludhiana,V4035:CY00OK
636,Cogidoo,image/jpeg,TV/Audio/Video & Movies,53,"Morbi vestibulum, velit id pretium iaculis, diam erat fermentum justo, nec condimentum neque sapien placerat ante. Nulla justo.",3,30/09/2018,Rs.10 Cash Off,Amritsar,B4958:N4DD6W
637,Dablist,image/tiff,Computers,96,Cras pellentesque volutpat dui.,5,07/10/2018,FREE,Gorakhpur,W3810:8604XT
638,Yodo,image/tiff,Mobiles & Tablets,89,Mauris ullamcorper purus sit amet nulla.,2,22/10/2018,70% Discount,Solapur,H5510:5A6FAJ
639,JumpXS,image/pjpeg,Beauty & Health,90,Pellentesque at nulla.,0,16/09/2018,90% Discount,Srinagar,B5899:RD5MR9
640,Shuffletag,image/gif,Computers,19,Nam nulla.,1,18/10/2018,30% Discount,Ludhiana,F2882:VJBBSE
641,Buzzdog,image/tiff,Fashion,76,Nunc purus.,0,29/10/2018,40% Discount,Shivaji Nagar,S0663:P3PFVX
642,Ozu,image/png,Entertainment,75,Nullam porttitor lacus at turpis.,5,04/10/2018,Rs.200 Cashback,Bengaluru,L3925:QHQR46
643,Zoomdog,image/jpeg,Laptops & Gaming,100,"Integer aliquet, massa id lobortis convallis, tortor risus dapibus augue, vel accumsan tellus nisi eu orci.",3,12/10/2018,Rs.300 Cash Off,Allahabad,K5773:XHJO7T
644,Camido,image/png,Computers,82,Suspendisse accumsan tortor quis turpis. Sed ante.,3,28/10/2018,40% Discount,Jabalpur,V2780:P7E9XV
645,Devbug,image/x-tiff,Computers,17,Pellentesque at nulla. Suspendisse potenti.,2,04/10/2018,60% Discount,Nashik,C0736:ALQSLZ
646,Realcube,image/gif,Food & Dining,5,"Cum sociis natoque penatibus et magnis dis parturient montes, nascetur ridiculus mus.",3,24/09/2018,Rs.30 Cash Off,Meerut,H0390:71BT33
647,Devshare,image/gif,Fashion,31,"Morbi sem mauris, laoreet ut, rhoncus aliquet, pulvinar sed, nisl.",1,30/09/2018,Rs.100 Cash Off,Jaipur,Q2832:Y5H1RD
648,Jetpulse,image/x-tiff,Laptops & Gaming,85,"Morbi quis tortor id nulla ultrices aliquet. Maecenas leo odio, condimentum id, luctus nec, molestie sed, justo.",0,15/09/2018,30% Discount,Kalyan,D2962:GQUJG8
649,Demimbu,image/png,Mobiles & Tablets,99,"Fusce congue, diam id ornare imperdiet, sapien urna pretium nisl, ut volutpat sapien arcu sed augue.",4,21/09/2018,Rs.500 Cash Off,Surat,M6847:Y6NSIT
650,Centimia,image/jpeg,Computers,54,Duis at velit eu est congue elementum.,3,23/10/2018,Rs.100 Cashback,Kalyan,J2784:7LZUPG
651,Tambee,image/x-tiff,Mobiles & Tablets,51,Sed ante.,2,01/10/2018,90% Discount,Navi Mumbai,H5082:K017OA
652,Yodoo,image/pjpeg,Fashion,76,"Donec diam neque, vestibulum eget, vulputate ut, ultrices vel, augue. Vestibulum ante ipsum primis in faucibus orci luctus et ultrices posuere cubilia Curae; Donec pharetra, magna vestibulum aliquet ultrices, erat tortor sollicitudin mi, sit amet lobortis sapien sapien non mi.",5,29/10/2018,Rs.400 Cashback,Vijayawada,L3275:GME1CK
653,Skynoodle,image/tiff,Mobiles & Tablets,69,Aenean fermentum. Donec ut mauris eget massa tempor convallis.,3,30/10/2018,60% Discount,Chandigarh,B1808:EE6BCH
654,Izio,image/pjpeg,Home Furnishing & Decor,14,"Cum sociis natoque penatibus et magnis dis parturient montes, nascetur ridiculus mus.",2,02/10/2018,Rs.400 Cashback,Jabalpur,P2428:IDB8Q1
655,Dabshots,image/tiff,Laptops & Gaming,90,Proin eu mi. Nulla ac enim.,0,24/09/2018,Rs.60 Cash Off,Agra,N1110:QVJZBO
656,Demizz,image/pjpeg,Food & Dining,78,Nullam molestie nibh in lectus. Pellentesque at nulla.,4,22/10/2018,Rs.400 Cashback,Surat,E2311:EU95TN
657,Yambee,image/tiff,Laptops & Gaming,69,Integer ac neque. Duis bibendum.,1,12/09/2018,Rs.50 Cashback,Vadodara,S7675:1V3M0I
658,Skimia,image/gif,Recharge,63,Pellentesque ultrices mattis odio.,4,22/10/2018,80% Discount,Delhi,R0970:7FUQAC
659,Eadel,image/x-tiff,Laptops & Gaming,54,"Mauris ullamcorper purus sit amet nulla. Quisque arcu libero, rutrum ac, lobortis vel, dapibus at, diam.",2,05/10/2018,Rs.100 Cashback,Rajkot,X5680:UDDL84
660,Rhybox,image/jpeg,Fashion,78,Nam dui.,5,03/10/2018,Rs.50 Cashback,Jaipur,C6608:IAYBJS
661,Dabfeed,image/gif,Home Furnishing & Decor,54,"Maecenas leo odio, condimentum id, luctus nec, molestie sed, justo. Pellentesque viverra pede ac diam.",1,23/10/2018,Rs.500 Cashback,Lucknow,N4331:GFG1ZR
662,Brightdog,image/jpeg,Computers,38,Mauris lacinia sapien quis libero. Nullam sit amet turpis elementum ligula vehicula consequat.,5,18/09/2018,40% Discount,Vijayawada,I1551:DVXK18
663,Tagchat,image/x-tiff,Food & Dining,60,Pellentesque at nulla.,5,21/09/2018,Rs.30 Cash Off,Faridabad,C6017:VN5JKP
664,Blogtags,image/png,Entertainment,15,"Phasellus id sapien in sapien iaculis congue. Vivamus metus arcu, adipiscing molestie, hendrerit at, vulputate vitae, nisl.",5,10/10/2018,Rs.30 Cash Off,Chandigarh,D4198:ZX0DAU
665,Buzzster,image/gif,Laptops & Gaming,91,Praesent blandit.,2,18/09/2018,Rs.90 Cash Off,Jodhpur,R6987:8YJLBB
666,Realbuzz,image/png,Home Furnishing & Decor,21,"Donec diam neque, vestibulum eget, vulputate ut, ultrices vel, augue. Vestibulum ante ipsum primis in faucibus orci luctus et ultrices posuere cubilia Curae; Donec pharetra, magna vestibulum aliquet ultrices, erat tortor sollicitudin mi, sit amet lobortis sapien sapien non mi.",3,15/10/2018,Rs.50 Cash Off,Chandigarh,T6401:KJ9SPG
667,Trudeo,image/x-tiff,Beauty & Health,5,"Vivamus vestibulum sagittis sapien. Cum sociis natoque penatibus et magnis dis parturient montes, nascetur ridiculus mus.",0,05/10/2018,Rs.300 Cash Off,Allahabad,B6334:JX7J9D
668,Browsecat,image/x-tiff,Recharge,47,Curabitur in libero ut massa volutpat convallis.,1,02/10/2018,60% Discount,Allahabad,L3211:MNKG3D
