_id,name,logo,category,used,details,reviews,expires_on,type,location,code
669,Edgetag,image/jpeg,Recharge,66,Aenean sit amet justo. Morbi ut odio.,1,07/10/2018,Rs.50 Cashback,Jabalpur,O5020:71OGX3
670,Kamba,image/png,Beauty & Health,13,Pellentesque viverra pede ac diam. Cras pellentesque volutpat dui.,2,16/09/2018,30% Discount,Kolkata,V2531:USHCT1
671,Linkbridge,image/png,Entertainment,20,Duis at velit eu est congue elementum.,1,13/10/2018,Rs.500 Cash Off,Pimpri,O1658:ES3XXE
672,Eamia,image/x-tiff,Beauty & Health,30,In hac habitasse platea dictumst. Etiam faucibus cursus urna.,5,29/10/2018,Rs.300 Cashback,Hyderabad,D1611:99RNZU
673,Devpoint,image/tiff,Laptops & Gaming,53,Maecenas ut massa quis augue luctus tincidunt.,2,13/10/2018,80% Discount,Teni,T6629:LDTJ06
674,Izio,image/png,Beauty & Health,95,Donec posuere metus vitae ipsum. Aliquam non mauris.,0,01/10/2018,Rs.200 Cash Off,Ahmedabad,V3221:ZWPX5D
675,Jabbersphere,image/jpeg,Food & Dining,20,Nulla justo.,5,30/10/2018,Rs.40 Cash Off,Lucknow,J9565:KG05JA
676,Blognation,image/jpeg,Entertainment,87,Etiam faucibus cursus urna.,0,25/09/2018,40% Discount,Kolkata,I3241:E8MYYZ
677,Youbridge,image/png,Laptops & Gaming,23,Duis aliquam convallis nunc.,3,13/10/2018,Rs.500 Cashback,Nashik,O9109:TRKD7Q
678,Voomm,image/pjpeg,Computers,24,Proin risus.,4,05/10/2018,Rs.500 Cashback,Amritsar,H1809:Y54VVA
679,Thoughtworks,image/tiff,Entertainment,42,"Donec odio justo, sollicitudin ut, suscipit a, feugiat et, eros. Vestibulum ac est lacinia nisi venenatis tristique.",2,26/09/2018,FREE,Kalyan,L1937:0S9STI
680,Photolist,image/jpeg,Laptops & Gaming,9,Morbi quis tortor id nulla ultrices aliquet.,0,01/10/2018,20% Discount,Srinagar,L9905:MZHJRC
681,Voonte,image/tiff,TV/Audio/Video & Movies,14,Vestibulum ante ipsum primis in faucibus orci luctus et ultrices posuere cubilia Curae; Duis faucibus accumsan odio.,0,12/10/2018,Rs.500 Cash Off,Gorakhpur,L9376:ACLUCT
682,Chatterpoint,image/pjpeg,Fashion,12,"Aliquam sit amet diam in magna bibendum imperdiet. Nullam orci pede, venenatis non, sodales sed, tincidunt eu, felis.",1,21/09/2018,Rs.300 Cashback,Nagpur,O1943:RCMOZL
683,Yakitri,image/jpeg,Home Furnishing & Decor,4,"In tempor, turpis nec euismod scelerisque, quam turpis adipiscing lorem, vitae mattis nibh ligula nec sem.",4,22/10/2018,70% Discount,Shivaji Nagar,P5160:ZTMHKV
684,Meemm,image/pjpeg,Home Furnishing & Decor,54,Etiam justo.,0,01/10/2018,Rs.50 Cash Off,Surat,M8640:E5N5WZ
685,Rhyloo,image/png,Computers,15,Donec ut dolor.,0,26/10/2018,Rs.200 Cash Off,Agra,E4954:XBJO1D
686,Ntag,image/jpeg,Recharge,68,Curabitur in libero ut massa volutpat convallis.,5,13/09/2018,Rs.10 Cash Off,Solapur,Z1790:9B1RLR
687,Bluezoom,image/jpeg,Beauty & Health,4,Sed ante.,5,28/10/2018,30% Discount,Kolkata,K1536:HJY5HJ
688,Dabfeed,image/png,Computers,16,"Aliquam augue quam, sollicitudin vitae, consectetuer eget, rutrum at, lorem. Integer tincidunt ante vel ipsum.",4,12/10/2018,Rs.90 Cash Off,Vadodara,U5502:8OAHMS
689,Innotype,image/tiff,Laptops & Gaming,54,Praesent id massa id nisl venenatis lacinia.,1,09/10/2018,Rs.200 Cash Off,Kolkata,G4917:074YLH
690,Devify,image/png,Mobiles & Tablets,13,In congue. Etiam justo.,2,01/10/2018,Rs.300 Cash Off,Haora,W0080:MV3LA3
691,Vitz,image/png,Laptops & Gaming,61,Morbi a ipsum.,3,17/09/2018,Rs.20 Cash Off,Faridabad,Q2261:UXUAKI
692,Buzzbean,image/gif,TV/Audio/Video & Movies,92,Morbi non lectus. Aliquam sit amet diam in magna bibendum imperdiet.,3,25/09/2018,Rs.400 Cash Off,Jabalpur,X0125:G1F11G
693,Blognation,image/gif,Computers,63,"Mauris ullamcorper purus sit amet nulla. Quisque arcu libero, rutrum ac, lobortis vel, dapibus at, diam.",1,27/10/2018,60% Discount,Indore,A7368:8NLMJN
694,Bubblebox,image/pjpeg,Computers,44,Nulla mollis molestie lorem. Quisque ut erat.,1,29/10/2018,Rs.10 Cash Off,Nowrangapur,A9552:OIY2SS
695,Oloo,image/png,TV/Audio/Video & Movies,95,Phasellus sit amet erat. Nulla tempus.,0,03/10/2018,Rs.40 Cash Off,Meerut,Q7110:6FXC15
696,Yoveo,image/gif,Food & Dining,40,Integer tincidunt ante vel ipsum. Praesent blandit lacinia erat.,0,06/10/2018,60% Discount,Ludhiana,V3741:V2MW4S
697,Tagfeed,image/gif,Home Furnishing & Decor,94,Proin eu mi.,0,21/10/2018,Rs.400 Cashback,Aurangabad,S4138:FVNHTT
698,Quatz,image/png,Laptops & Gaming,22,Curabitur in libero ut massa volutpat convallis.,2,14/09/2018,60% Discount,Rajkot,T8690:4Y3LNC
699,Babblestorm,image/tiff,Food & Dining,88,Curabitur convallis. Duis consequat dui nec nisi volutpat eleifend.,1,06/10/2018,Rs.70 Cash Off,Delhi,O7659:BI32OK
700,Kanoodle,image/jpeg,Entertainment,88,In quis justo.,2,22/10/2018,Rs.70 Cash Off,Bengaluru,V6284:NAZIOT
701,Rooxo,image/gif,Mobiles & Tablets,59,"Aliquam augue quam, sollicitudin vitae, consectetuer eget, rutrum at, lorem. Integer tincidunt ante vel ipsum.",2,05/10/2018,Rs.400 Cash Off,Bengaluru,A1714:H7Q6VF
702,DabZ,image/pjpeg,Entertainment,8,In hac habitasse platea dictumst. Etiam faucibus cursus urna.,1,11/10/2018,Rs.80 Cash Off,Lucknow,P1498:6H195T
703,Brainbox,image/x-tiff,Fashion,2,"Nam dui. Proin leo odio, porttitor id, consequat in, consequat ut, nulla.",5,27/10/2018,Rs.100 Cash Off,Navi Mumbai,U3284:79TD6Z
704,Chatterbridge,image/pjpeg,Beauty & Health,10,Nam dui.,3,24/09/2018,FREE,Shivaji Nagar,B9354:DPM0AM
705,Trilia,image/png,Entertainment,21,Curabitur in libero ut massa volutpat convallis.,2,30/10/2018,Rs.100 Cashback,Vadodara,R4844:XELKRG
706,Thoughtbridge,image/jpeg,Entertainment,12,"Fusce posuere felis sed lacus. Morbi sem mauris, laoreet ut, rhoncus aliquet, pulvinar sed, nisl.",3,15/09/2018,Rs.400 Cash Off,Lucknow,G7967:3BMHZL
707,Twitterbeat,image/tiff,Mobiles & Tablets,62,Curabitur at ipsum ac tellus semper interdum. Mauris ullamcorper purus sit amet nulla.,2,09/10/2018,Rs.50 Cashback,Visakhapatnam,A2509:QD35SC
708,Youspan,image/pjpeg,Home Furnishing & Decor,71,"Nulla neque libero, convallis eget, eleifend luctus, ultricies eu, nibh.",1,25/09/2018,Rs.100 Cashback,Patna,G3311:DVQHUV
709,Skimia,image/jpeg,Recharge,87,"Quisque porta volutpat erat. Quisque erat eros, viverra eget, congue eget, semper rutrum, nulla.",4,03/10/2018,Rs.70 Cash Off,Srinagar,A1948:WVTMW1
710,Bubbletube,image/pjpeg,TV/Audio/Video & Movies,31,Duis consequat dui nec nisi volutpat eleifend.,4,29/10/2018,Rs.60 Cash Off,Visakhapatnam,T5692:SR2D81
711,Jetpulse,image/png,Fashion,14,Fusce consequat.,3,03/10/2018,Rs.200 Cash Off,Patna,M5740:L2D143
712,Skivee,image/jpeg,Computers,90,"Cum sociis natoque penatibus et magnis dis parturient montes, nascetur ridiculus mus.",0,20/09/2018,Rs.500 Cashback,Teni,K5084:J95FGL
713,Linkbridge,image/png,Food & Dining,11,Nulla suscipit ligula in lacus. Curabitur at ipsum ac tellus semper interdum.,2,27/10/2018,Rs.90 Cash Off,Nashik,N2067:WR3BAR
714,Chatterbridge,image/pjpeg,Fashion,79,Etiam vel augue. Vestibulum rutrum rutrum neque.,2,18/09/2018,Rs.30 Cash Off,Jabalpur,H7297:D5UG7J
715,Janyx,image/png,TV/Audio/Video & Movies,32,Duis consequat dui nec nisi volutpat eleifend.,4,15/10/2018,40% Discount,Ahmedabad,V9789:MO1NZH
716,Meejo,image/tiff,Home Furnishing & Decor,71,"Morbi odio odio, elementum eu, interdum eu, tincidunt in, leo.",0,25/10/2018,Rs.60 Cash Off,Amritsar,I4148:A6ZFVE
717,Eare,image/tiff,Entertainment,57,Vestibulum ante ipsum primis in faucibus orci luctus et ultrices posuere cubilia Curae; Mauris viverra diam vitae quam.,2,17/09/2018,Rs.300 Cash Off,Indore,X2533:B73V1P
718,Meembee,image/x-tiff,Laptops & Gaming,18,"Cum sociis natoque penatibus et magnis dis parturient montes, nascetur ridiculus mus.",1,27/10/2018,Rs.100 Cash Off,Hyderabad,D7966:SMZTFF
719,Wikizz,image/tiff,Laptops & Gaming,60,Donec ut dolor. Morbi vel lectus in quam fringilla rhoncus.,2,05/10/2018,Rs.70 Cash Off,Amritsar,R3618:LNB9KS
720,Meejo,image/tiff,Fashion,80,Etiam vel augue. Vestibulum rutrum rutrum neque.,0,21/10/2018,Rs.50 Cash Off,Bengaluru,G7153:OTX91T
721,Fivespan,image/png,Computers,42,Etiam justo.,2,16/09/2018,Rs.300 Cashback,Patna,R2348:FF6BEY
722,Linkbridge,image/tiff,Entertainment,6,"Sed sagittis. Nam congue, risus semper porta volutpat, quam pede lobortis ligula, sit amet eleifend pede libero quis orci.",1,13/09/2018,Rs.100 Cash Off,Kolkata,C1243:ZPYVGN
723,Jabbersphere,image/tiff,TV/Audio/Video & Movies,11,Etiam faucibus cursus urna. Ut tellus.,0,17/10/2018,Rs.100 Cash Off,Amritsar,E4502:WPK25O
724,Skilith,image/gif,Food & Dining,30,"Quisque arcu libero, rutrum ac, lobortis vel, dapibus at, diam.",4,13/09/2018,10% Discount,Hyderabad,N5650:F0AGMA
725,Meembee,image/jpeg,Entertainment,44,"Fusce congue, diam id ornare imperdiet, sapien urna pretium nisl, ut volutpat sapien arcu sed augue.",2,26/10/2018,60% Discount,Bhopal,H2073:GBRQIX
726,Fivebridge,image/gif,Home Furnishing & Decor,52,Sed accumsan felis.,0,17/10/2018,70% Discount,Surat,B5670:Q94WP7
727,Jayo,image/gif,Mobiles & Tablets,49,"Nam congue, risus semper porta volutpat, quam pede lobortis ligula, sit amet eleifend pede libero quis orci. Nullam molestie nibh in lectus.",1,14/10/2018,Rs.90 Cash Off,Gwalior,G5014:HNAQNN
728,Zoomdog,image/gif,Fashion,20,In hac habitasse platea dictumst. Etiam faucibus cursus urna.,4,16/09/2018,Rs.400 Cashback,Indore,U0766:HOBFZU
729,Voonder,image/pjpeg,Mobiles & Tablets,77,Donec semper sapien a libero. Nam dui.,0,30/10/2018,Rs.70 Cash Off,Jodhpur,C1015:KZZR6L
730,Fanoodle,image/x-tiff,Fashion,82,"Vestibulum ante ipsum primis in faucibus orci luctus et ultrices posuere cubilia Curae; Nulla dapibus dolor vel est. Donec odio justo, sollicitudin ut, suscipit a, feugiat et, eros.",0,01/10/2018,Rs.500 Cash Off,Srinagar,P9525:QPN948
731,Agivu,image/pjpeg,Recharge,56,Aliquam non mauris. Morbi non lectus.,3,11/10/2018,Rs.40 Cash Off,Ahmedabad,R1985:Y9ZNVY
732,Jaxspan,image/jpeg,TV/Audio/Video & Movies,64,Donec ut dolor. Morbi vel lectus in quam fringilla rhoncus.,3,12/09/2018,Rs.60 Cash Off,Nashik,D9747:6N4J0K
733,Gabtype,image/pjpeg,TV/Audio/Video & Movies,78,"Cum sociis natoque penatibus et magnis dis parturient montes, nascetur ridiculus mus.",1,06/10/2018,80% Discount,Nashik,T4161:V0HEBN
734,LiveZ,image/png,Laptops & Gaming,27,In quis justo.,5,21/09/2018,Rs.80 Cash Off,Shivaji Nagar,F8648:09YLYD
735,Latz,image/png,Recharge,6,"Nam ultrices, libero non mattis pulvinar, nulla pede ullamcorper augue, a suscipit nulla elit ac nulla.",1,12/10/2018,Rs.60 Cash Off,Tirunelveli,K0581:OQVX1Q
736,Dynava,image/png,Beauty & Health,74,Praesent id massa id nisl venenatis lacinia. Aenean sit amet justo.,0,19/09/2018,60% Discount,Agra,J2498:VT2V5J
737,Edgeify,image/pjpeg,Home Furnishing & Decor,36,"Suspendisse ornare consequat lectus. In est risus, auctor sed, tristique in, tempus sit amet, sem.",2,02/10/2018,Rs.300 Cash Off,Ahmedabad,M6999:S7PE47
738,Lazzy,image/tiff,Recharge,85,Pellentesque viverra pede ac diam.,0,19/09/2018,Rs.100 Cashback,Rajkot,G2450:9HPEJ9
739,Feedfire,image/jpeg,Fashion,85,Duis aliquam convallis nunc.,2,13/09/2018,90% Discount,Vadodara,M6445:B2URTX
740,Youtags,image/gif,Computers,27,Maecenas tincidunt lacus at velit.,2,17/10/2018,Rs.50 Cashback,Mumbai,Z6440:USRUO7
741,Thoughtblab,image/jpeg,Food & Dining,26,Morbi porttitor lorem id ligula.,4,28/09/2018,Rs.20 Cash Off,Teni,S2082:OV5Q7G
742,Realcube,image/jpeg,Food & Dining,68,Nunc purus.,5,07/10/2018,Rs.200 Cashback,Guwahati,K8464:SHU5ER
743,Blogpad,image/x-tiff,Food & Dining,58,Donec semper sapien a libero.,0,30/09/2018,Rs.90 Cash Off,Faridabad,N2141:JVFYHX
744,Zazio,image/x-tiff,Beauty & Health,90,Donec ut dolor.,0,21/10/2018,Rs.70 Cash Off,Delhi,X5261:KV5I6L
745,Twinder,image/tiff,Recharge,89,Nunc purus. Phasellus in felis.,2,23/09/2018,Rs.100 Cashback,Nashik,L1575:7RDLZ3
746,Agimba,image/jpeg,Entertainment,11,Suspendisse accumsan tortor quis turpis.,2,12/10/2018,Rs.300 Cash Off,Surat,U3903:RPPUQF
747,Skyba,image/tiff,Computers,15,Nulla tempus. Vivamus in felis eu sapien cursus vestibulum.,3,15/10/2018,Rs.60 Cash Off,Allahabad,C6770:DJ4YWX
748,Bubblemix,image/png,Mobiles & Tablets,53,Nulla tellus. In sagittis dui vel nisl.,1,27/10/2018,Rs.100 Cashback,Coimbatore,U5104:DKKHYJ
749,Skivee,image/gif,Laptops & Gaming,66,Proin risus.,4,21/09/2018,60% Discount,Nashik,L8765:KVZ1K7
750,Npath,image/x-tiff,Food & Dining,69,Integer ac leo. Pellentesque ultrices mattis odio.,5,07/10/2018,90% Discount,Vadodara,U4080:UECEC1
751,Shufflebeat,image/pjpeg,Home Furnishing & Decor,77,"Lorem ipsum dolor sit amet, consectetuer adipiscing elit.",2,28/09/2018,Rs.90 Cash Off,Amritsar,H5537:7YF3P1
752,Thoughtstorm,image/pjpeg,Entertainment,58,Mauris lacinia sapien quis libero. Nullam sit amet turpis elementum ligula vehicula consequat.,2,15/10/2018,Rs.200 Cash Off,Pimpri,N4546:QL2VQW
753,Skinte,image/pjpeg,Home Furnishing & Decor,63,"Fusce congue, diam id ornare imperdiet, sapien urna pretium nisl, ut volutpat sapien arcu sed augue.",5,13/10/2018,10% Discount,Pune,K6218:C5PP3I
754,Realblab,image/png,Computers,82,"Phasellus id sapien in sapien iaculis congue. Vivamus metus arcu, adipiscing molestie, hendrerit at, vulputate vitae, nisl.",0,14/09/2018,Rs.50 Cash Off,Hyderabad,P9693:0QRQPG
755,Fadeo,image/png,Home Furnishing & Decor,11,"In blandit ultrices enim. Lorem ipsum dolor sit amet, consectetuer adipiscing elit.",0,30/09/2018,Rs.300 Cash Off,Delhi,R3996:1YHDTS
756,Roodel,image/png,Food & Dining,24,"Morbi ut odio. Cras mi pede, malesuada in, imperdiet et, commodo vulputate, justo.",3,26/09/2018,60% Discount,Vijayawada,G7057:UNVCE0
757,Trilia,image/pjpeg,Laptops & Gaming,13,Integer non velit.,5,06/10/2018,50% Discount,Allahabad,Q2712:W762ER
758,Eire,image/png,Recharge,38,Integer ac neque. Duis bibendum.,1,28/09/2018,Rs.70 Cash Off,Jaipur,D9020:GV9SC3
759,Geba,image/gif,Laptops & Gaming,55,Nullam porttitor lacus at turpis. Donec posuere metus vitae ipsum.,1,28/09/2018,Rs.400 Cash Off,Jaipur,U4777:PHF628
760,Feednation,image/x-tiff,Beauty & Health,93,Praesent blandit lacinia erat.,2,19/10/2018,Rs.70 Cash Off,Ahmedabad,V9640:60EGAK
761,Wordify,image/tiff,Mobiles & Tablets,77,Nullam porttitor lacus at turpis. Donec posuere metus vitae ipsum.,4,26/10/2018,40% Discount,Gorakhpur,L6116:RY9RBW
762,Wordify,image/pjpeg,Home Furnishing & Decor,74,Mauris lacinia sapien quis libero.,1,21/09/2018,Rs.90 Cash Off,Nashik,V2521:NAJZYS
763,Browsecat,image/x-tiff,Mobiles & Tablets,24,"In est risus, auctor sed, tristique in, tempus sit amet, sem. Fusce consequat.",1,24/10/2018,Rs.300 Cash Off,Ludhiana,P3510:JI6TI4
764,Blogpad,image/x-tiff,Food & Dining,48,In hac habitasse platea dictumst.,5,28/10/2018,Rs.90 Cash Off,Gwalior,E1149:9CR2QC
765,Zoonder,image/png,Laptops & Gaming,24,Suspendisse potenti. Cras in purus eu magna vulputate luctus.,3,30/10/2018,Rs.400 Cashback,Patna,F6004:04LNJJ
766,Eire,image/gif,Food & Dining,77,"In tempor, turpis nec euismod scelerisque, quam turpis adipiscing lorem, vitae mattis nibh ligula nec sem.",2,20/10/2018,Rs.70 Cash Off,Haora,D7411:2D3G3P
767,Avavee,image/tiff,TV/Audio/Video & Movies,75,Sed ante.,0,25/09/2018,Rs.500 Cashback,Solapur,M8249:H48NA3
768,Fadeo,image/tiff,Laptops & Gaming,99,"Integer aliquet, massa id lobortis convallis, tortor risus dapibus augue, vel accumsan tellus nisi eu orci. Mauris lacinia sapien quis libero.",5,25/10/2018,80% Discount,Ahmedabad,O9044:CZ2ZU3
769,Avaveo,image/gif,Recharge,75,Donec ut mauris eget massa tempor convallis.,2,26/10/2018,Rs.500 Cashback,Agra,P6698:H7QB8G
770,Fatz,image/x-tiff,Entertainment,16,Nullam varius.,4,19/09/2018,Rs.300 Cashback,Varanasi,L6465:Q00691
771,Thoughtsphere,image/jpeg,Entertainment,62,Nullam molestie nibh in lectus.,5,11/10/2018,90% Discount,Rajkot,F2478:BMW191
772,Zoonder,image/tiff,Recharge,80,Etiam vel augue.,4,15/09/2018,Rs.80 Cash Off,Pune,M2200:UOV6KL
773,Zooxo,image/png,Laptops & Gaming,77,"Cras in purus eu magna vulputate luctus. Cum sociis natoque penatibus et magnis dis parturient montes, nascetur ridiculus mus.",3,19/10/2018,Rs.500 Cashback,Nowrangapur,U5712:YZ01OK
774,Linkbridge,image/x-tiff,TV/Audio/Video & Movies,26,"Quisque erat eros, viverra eget, congue eget, semper rutrum, nulla.",5,05/10/2018,20% Discount,Varanasi,X2853:14SEJN
775,Yamia,image/x-tiff,Laptops & Gaming,39,"Vivamus metus arcu, adipiscing molestie, hendrerit at, vulputate vitae, nisl. Aenean lectus.",0,27/09/2018,30% Discount,Patna,E6055:5DSLT2
776,Eadel,image/x-tiff,Food & Dining,84,"Vivamus metus arcu, adipiscing molestie, hendrerit at, vulputate vitae, nisl.",3,28/09/2018,FREE,Ghaziabad,M6315:O5T2IM
777,Wordpedia,image/png,Computers,13,Vestibulum rutrum rutrum neque. Aenean auctor gravida sem.,5,27/10/2018,FREE,Navi Mumbai,U7949:BRKFZS
778,Voonix,image/png,Beauty & Health,40,Aenean auctor gravida sem.,0,25/09/2018,60% Discount,Guwahati,Z3391:NMHW2D
779,Devshare,image/pjpeg,Recharge,99,"Lorem ipsum dolor sit amet, consectetuer adipiscing elit. Proin interdum mauris non ligula pellentesque ultrices.",3,26/10/2018,Rs.50 Cash Off,Dombivli,E6310:AA4SUH
780,Fivespan,image/x-tiff,Home Furnishing & Decor,21,Morbi ut odio.,0,04/10/2018,Rs.80 Cash Off,Teni,P4532:0XDAZ1
781,Trupe,image/tiff,Fashion,56,Cras pellentesque volutpat dui.,2,19/10/2018,Rs.100 Cashback,Madurai,U8047:BI6FNL
782,Rhynoodle,image/gif,Recharge,23,"Nam congue, risus semper porta volutpat, quam pede lobortis ligula, sit amet eleifend pede libero quis orci. Nullam molestie nibh in lectus.",1,09/10/2018,Rs.50 Cash Off,Dombivli,S4261:R8DZKO
783,Dynazzy,image/jpeg,Recharge,4,"Duis bibendum, felis sed interdum venenatis, turpis enim blandit mi, in porttitor pede justo eu massa.",0,17/09/2018,40% Discount,Surat,V1372:BQRE4I
784,Oyoba,image/png,Home Furnishing & Decor,62,Nulla ut erat id mauris vulputate elementum. Nullam varius.,2,28/10/2018,Rs.300 Cashback,Ludhiana,W1051:K13O7V
785,Flipstorm,image/jpeg,Beauty & Health,90,Suspendisse ornare consequat lectus.,4,15/09/2018,20% Discount,Solapur,I7507:MAXGYW
786,Skimia,image/gif,Beauty & Health,48,Duis consequat dui nec nisi volutpat eleifend.,1,29/10/2018,Rs.90 Cash Off,Bhopal,V1522:SOVHLL
787,Eazzy,image/x-tiff,TV/Audio/Video & Movies,3,Nulla tellus. In sagittis dui vel nisl.,1,24/10/2018,Rs.200 Cashback,Chandigarh,J1171:4AN6SP
788,Skyba,image/png,Beauty & Health,57,"Nam congue, risus semper porta volutpat, quam pede lobortis ligula, sit amet eleifend pede libero quis orci. Nullam molestie nibh in lectus.",3,25/09/2018,Rs.30 Cash Off,Ludhiana,S1055:YUUIAW
789,Jaxnation,image/png,Home Furnishing & Decor,22,"Lorem ipsum dolor sit amet, consectetuer adipiscing elit. Proin interdum mauris non ligula pellentesque ultrices.",0,26/09/2018,80% Discount,Dombivli,E7146:7QWWXM
790,Plambee,image/x-tiff,Mobiles & Tablets,54,Curabitur gravida nisi at nibh.,0,15/09/2018,Rs.500 Cash Off,Chennai,R1167:G1M2ZY
791,Wordify,image/tiff,Computers,56,Donec semper sapien a libero. Nam dui.,5,10/10/2018,Rs.30 Cash Off,Dombivli,Z5876:HE0HY8
792,Thoughtbeat,image/tiff,Fashion,52,Aliquam erat volutpat. In congue.,3,29/09/2018,90% Discount,Agra,W0036:9QV837
793,Quimm,image/gif,Food & Dining,73,Nulla facilisi.,1,26/09/2018,Rs.90 Cash Off,Coimbatore,X0274:6AEDRY
794,Thoughtbridge,image/gif,Recharge,71,"Morbi sem mauris, laoreet ut, rhoncus aliquet, pulvinar sed, nisl. Nunc rhoncus dui vel sem.",0,18/10/2018,FREE,Aurangabad,F4361:WHYQH4
795,Fivechat,image/jpeg,Mobiles & Tablets,49,"Morbi vestibulum, velit id pretium iaculis, diam erat fermentum justo, nec condimentum neque sapien placerat ante. Nulla justo.",5,28/09/2018,90% Discount,Aurangabad,V4593:C00NOV
796,Edgeify,image/tiff,Laptops & Gaming,13,"Integer non velit. Donec diam neque, vestibulum eget, vulputate ut, ultrices vel, augue.",1,05/10/2018,Rs.20 Cash Off,Gorakhpur,I1719:5HOIAJ
797,Browsetype,image/jpeg,TV/Audio/Video & Movies,57,"Morbi vestibulum, velit id pretium iaculis, diam erat fermentum justo, nec condimentum neque sapien placerat ante.",0,22/10/2018,10% Discount,Hyderabad,Y0692:WROAXZ
798,Twitterlist,image/pjpeg,Home Furnishing & Decor,83,Ut tellus. Nulla ut erat id mauris vulputate elementum.,2,25/10/2018,80% Discount,Lucknow,K9878:A802JP
799,Photobug,image/gif,Mobiles & Tablets,85,In congue.,3,20/10/2018,30% Discount,Bengaluru,I0743:AWN135
800,Jazzy,image/jpeg,Food & Dining,82,Fusce consequat. Nulla nisl.,3,02/10/2018,60% Discount,Surat,K8011:K36NX8
801,Youopia,image/gif,Laptops & Gaming,90,"Nulla ac enim. In tempor, turpis nec euismod scelerisque, quam turpis adipiscing lorem, vitae mattis nibh ligula nec sem.",5,17/10/2018,Rs.80 Cash Off,Coimbatore,B5783:W7BP2G
802,Mydo,image/tiff,Mobiles & Tablets,75,Mauris lacinia sapien quis libero. Nullam sit amet turpis elementum ligula vehicula consequat.,4,03/10/2018,Rs.90 Cash Off,Jaipur,M8090:13M9RK
803,Quaxo,image/gif,Entertainment,78,"In blandit ultrices enim. Lorem ipsum dolor sit amet, consectetuer adipiscing elit.",4,22/10/2018,Rs.90 Cash Off,Nagpur,I2811:D7XJIP
804,Trupe,image/jpeg,Computers,7,Suspendisse ornare consequat lectus.,5,15/09/2018,Rs.300 Cash Off,Ludhiana,D6487:OHLER1
805,Voonder,image/jpeg,Recharge,36,Morbi non quam nec dui luctus rutrum.,5,20/09/2018,Rs.400 Cash Off,Rajkot,T4772:EV2ANH
806,Zoonder,image/pjpeg,Entertainment,55,Donec ut dolor. Morbi vel lectus in quam fringilla rhoncus.,3,16/09/2018,40% Discount,Delhi,C0386:K74NSP
807,Flipbug,image/x-tiff,Fashion,79,Duis aliquam convallis nunc.,3,27/10/2018,Rs.100 Cash Off,Thane,S5086:K3F6QG
808,Blogpad,image/gif,Mobiles & Tablets,55,"In tempor, turpis nec euismod scelerisque, quam turpis adipiscing lorem, vitae mattis nibh ligula nec sem. Duis aliquam convallis nunc.",5,22/10/2018,50% Discount,Agra,J8416:HQT2BG
809,Zooxo,image/x-tiff,Beauty & Health,82,Vivamus vestibulum sagittis sapien.,1,10/10/2018,Rs.20 Cash Off,Navi Mumbai,P3700:HVMJE6
810,Eamia,image/x-tiff,TV/Audio/Video & Movies,25,Nullam porttitor lacus at turpis.,4,27/10/2018,20% Discount,Gorakhpur,Y9484:9Q9RO6
811,Yakitri,image/jpeg,Recharge,1,Donec dapibus. Duis at velit eu est congue elementum.,4,26/10/2018,80% Discount,Rajkot,R0510:CMFTDX
812,Blogtag,image/gif,Entertainment,98,Etiam justo. Etiam pretium iaculis justo.,2,18/09/2018,Rs.20 Cash Off,Gwalior,R2808:LGWD6U
813,Bluezoom,image/pjpeg,Fashion,13,Morbi non quam nec dui luctus rutrum.,2,14/10/2018,Rs.80 Cash Off,Agra,F6258:GMM8XG
814,Flashdog,image/tiff,Home Furnishing & Decor,29,Etiam vel augue. Vestibulum rutrum rutrum neque.,0,07/10/2018,70% Discount,Haora,C8604:0N5JR4
815,Jabbersphere,image/pjpeg,Mobiles & Tablets,36,Donec semper sapien a libero.,4,26/10/2018,60% Discount,Agra,D2617:CSFHY0
816,Quatz,image/x-tiff,Home Furnishing & Decor,82,In quis justo. Maecenas rhoncus aliquam lacus.,2,25/10/2018,Rs.300 Cash Off,Haora,U3623:G016SD
817,Quatz,image/jpeg,Beauty & Health,8,Etiam faucibus cursus urna. Ut tellus.,0,22/10/2018,Rs.50 Cash Off,Nashik,R8187:4499AH
818,Riffpedia,image/png,Computers,45,"Fusce lacus purus, aliquet at, feugiat non, pretium quis, lectus. Suspendisse potenti.",5,29/10/2018,70% Discount,Srinagar,O9560:PZ9U24
819,Meezzy,image/pjpeg,Laptops & Gaming,82,"Fusce congue, diam id ornare imperdiet, sapien urna pretium nisl, ut volutpat sapien arcu sed augue.",3,12/10/2018,Rs.400 Cashback,Meerut,Y5952:LIITHL
820,Eire,image/x-tiff,Home Furnishing & Decor,12,Quisque porta volutpat erat.,2,29/10/2018,60% Discount,Bengaluru,T5607:1QEU9N
821,Fatz,image/x-tiff,Food & Dining,91,"Maecenas tristique, est et tempus semper, est quam pharetra magna, ac consequat metus sapien ut nunc.",2,19/10/2018,Rs.90 Cash Off,Lucknow,O8219:5CT0KH
822,Jabbersphere,image/x-tiff,Entertainment,63,Duis mattis egestas metus. Aenean fermentum.,2,17/09/2018,30% Discount,Teni,Q1071:JSFS8Y
823,Innotype,image/gif,TV/Audio/Video & Movies,15,Duis aliquam convallis nunc. Proin at turpis a pede posuere nonummy.,2,16/09/2018,Rs.500 Cash Off,Guwahati,M8462:1GGJXJ
824,Babbleset,image/gif,TV/Audio/Video & Movies,69,"Nulla neque libero, convallis eget, eleifend luctus, ultricies eu, nibh. Quisque id justo sit amet sapien dignissim vestibulum.",0,29/10/2018,Rs.50 Cashback,Nagpur,R1068:UEFT8C
825,Ooba,image/tiff,Fashion,31,Vestibulum rutrum rutrum neque.,5,22/10/2018,Rs.300 Cash Off,Bengaluru,M4968:BU6X40
826,Trudoo,image/jpeg,Home Furnishing & Decor,88,Morbi non quam nec dui luctus rutrum. Nulla tellus.,3,07/10/2018,Rs.200 Cash Off,Varanasi,R3068:1QN9WJ
827,Camido,image/png,Laptops & Gaming,33,Integer ac leo. Pellentesque ultrices mattis odio.,4,26/10/2018,Rs.90 Cash Off,Nowrangapur,T1958:C477EB
828,Linklinks,image/tiff,Recharge,91,"Fusce congue, diam id ornare imperdiet, sapien urna pretium nisl, ut volutpat sapien arcu sed augue. Aliquam erat volutpat.",5,30/09/2018,Rs.100 Cash Off,Nashik,A5915:AA1OCE
829,Kwideo,image/x-tiff,Home Furnishing & Decor,7,Vestibulum ante ipsum primis in faucibus orci luctus et ultrices posuere cubilia Curae; Duis faucibus accumsan odio. Curabitur convallis.,3,21/09/2018,20% Discount,Chandigarh,G6713:BBNRQ4
830,Eazzy,image/gif,Fashion,76,Vestibulum ante ipsum primis in faucibus orci luctus et ultrices posuere cubilia Curae; Duis faucibus accumsan odio. Curabitur convallis.,4,14/09/2018,50% Discount,Nagpur,F7931:ILRB80
831,Muxo,image/gif,Beauty & Health,80,Donec ut dolor. Morbi vel lectus in quam fringilla rhoncus.,4,21/09/2018,20% Discount,Dombivli,T4733:25ODD2
832,Topicblab,image/pjpeg,Recharge,45,Nunc rhoncus dui vel sem. Sed sagittis.,4,02/10/2018,Rs.30 Cash Off,Shivaji Nagar,X1694:EAXLIM
833,Mydo,image/x-tiff,Laptops & Gaming,12,"Lorem ipsum dolor sit amet, consectetuer adipiscing elit.",1,28/10/2018,40% Discount,Faridabad,B2566:H8EZVB
834,Centizu,image/jpeg,TV/Audio/Video & Movies,40,Aliquam non mauris. Morbi non lectus.,4,23/09/2018,Rs.20 Cash Off,Coimbatore,X9420:WWLD33
835,Meejo,image/pjpeg,Entertainment,14,"Cras pellentesque volutpat dui. Maecenas tristique, est et tempus semper, est quam pharetra magna, ac consequat metus sapien ut nunc.",5,24/10/2018,Rs.300 Cashback,Jaipur,E5968:N3AUXH
836,Skipstorm,image/tiff,Home Furnishing & Decor,29,Morbi non quam nec dui luctus rutrum.,1,29/10/2018,Rs.200 Cash Off,Patna,W9249:I4OQ3N
837,Mynte,image/png,Beauty & Health,39,"Donec diam neque, vestibulum eget, vulputate ut, ultrices vel, augue.",1,06/10/2018,Rs.80 Cash Off,Kalyan,D6040:FVLCRF
