_id,name,logo,category,used,details,reviews,expires_on,type,location,code
1,Tagcat,image/png,Laptops & Gaming,28,"Sed sagittis. Nam congue, risus semper porta volutpat, quam pede lobortis ligula, sit amet eleifend pede libero quis orci.",1,27/10/2018,Rs.200 Cash Off,Coimbatore,A3481:BJ0AOS
2,Skyndu,image/png,Laptops & Gaming,48,"Proin leo odio, porttitor id, consequat in, consequat ut, nulla.",2,06/10/2018,50% Discount,Solapur,A0935:76EBG9
3,Eidel,image/x-tiff,Recharge,96,Praesent id massa id nisl venenatis lacinia. Aenean sit amet justo.,4,16/10/2018,Rs.100 Cash Off,Pune,L6175:9OGH9V
4,Shufflebeat,image/pjpeg,Computers,85,"Donec vitae nisi. Nam ultrices, libero non mattis pulvinar, nulla pede ullamcorper augue, a suscipit nulla elit ac nulla.",4,23/09/2018,Rs.100 Cashback,Jodhpur,N6231:3HZ0UO
5,Buzzshare,image/png,Recharge,55,Aenean sit amet justo. Morbi ut odio.,5,18/09/2018,40% Discount,Allahabad,Q7680:YF91KP
6,Wordpedia,image/jpeg,Recharge,51,"Duis ac nibh. Fusce lacus purus, aliquet at, feugiat non, pretium quis, lectus.",2,30/10/2018,Rs.80 Cash Off,Nagpur,Z4823:YIT62H
7,Skimia,image/pjpeg,TV/Audio/Video & Movies,16,Phasellus in felis.,5,26/09/2018,40% Discount,Shivaji Nagar,S7360:308YIE
8,Leexo,image/png,Beauty & Health,81,Suspendisse potenti.,5,05/10/2018,Rs.300 Cash Off,Nashik,A2197:S11SRF
9,Voonte,image/png,Computers,92,"In blandit ultrices enim. Lorem ipsum dolor sit amet, consectetuer adipiscing elit.",1,29/10/2018,Rs.60 Cash Off,Coimbatore,O9682:MVBZWW
10,Feednation,image/png,Entertainment,48,"Cum sociis natoque penatibus et magnis dis parturient montes, nascetur ridiculus mus.",3,23/10/2018,Rs.30 Cash Off,Patna,U4674:C0GE9G
11,LiveZ,image/tiff,Mobiles & Tablets,38,Pellentesque viverra pede ac diam. Cras pellentesque volutpat dui.,5,15/09/2018,Rs.10 Cash Off,Agra,V5765:49ZE4V
12,Youopia,image/x-tiff,Mobiles & Tablets,46,Proin risus.,3,06/10/2018,Rs.90 Cash Off,Thane,N8932:Z5UL2B
13,Linkbuzz,image/jpeg,Computers,88,Nulla ut erat id mauris vulputate elementum.,2,26/09/2018,90% Discount,Visakhapatnam,V2944:UF8BOY
14,Wordpedia,image/gif,Recharge,35,Mauris lacinia sapien quis libero. Nullam sit amet turpis elementum ligula vehicula consequat.,0,14/09/2018,Rs.300 Cashback,Vadodara,V5158:3ZXJCP
15,Janyx,image/png,Food & Dining,63,In quis justo. Maecenas rhoncus aliquam lacus.,3,01/10/2018,Rs.500 Cashback,Lucknow,F9425:FM64VD
16,Topdrive,image/pjpeg,Food & Dining,82,Nunc purus.,4,28/09/2018,Rs.400 Cashback,Nashik,G9799:GACU2G
17,Devbug,image/x-tiff,Entertainment,27,Donec quis orci eget orci vehicula condimentum.,4,23/09/2018,Rs.300 Cashback,Coimbatore,G5178:3LSKMZ
18,Babbleopia,image/pjpeg,Fashion,27,Pellentesque viverra pede ac diam.,5,25/10/2018,Rs.300 Cash Off,Pimpri,U5290:T2UGFK
19,Brainverse,image/pjpeg,Laptops & Gaming,15,"Nullam orci pede, venenatis non, sodales sed, tincidunt eu, felis. Fusce posuere felis sed lacus.",4,21/10/2018,80% Discount,Chandigarh,C8031:MABANK
20,Edgetag,image/jpeg,Entertainment,80,"Maecenas leo odio, condimentum id, luctus nec, molestie sed, justo. Pellentesque viverra pede ac diam.",0,21/09/2018,50% Discount,Nagpur,P2749:DKFLMH
21,Jetpulse,image/gif,Mobiles & Tablets,44,"In est risus, auctor sed, tristique in, tempus sit amet, sem. Fusce consequat.",3,27/09/2018,Rs.10 Cash Off,Ghaziabad,L9846:TFVK48
22,Twimm,image/pjpeg,Laptops & Gaming,36,"In blandit ultrices enim. Lorem ipsum dolor sit amet, consectetuer adipiscing elit.",4,29/10/2018,Rs.40 Cash Off,Hyderabad,I7092:SH7TK5
23,Pixoboo,image/pjpeg,Entertainment,73,Nulla facilisi.,1,11/10/2018,Rs.400 Cash Off,Chandigarh,W7499:7J404Q
24,Vimbo,image/x-tiff,Laptops & Gaming,72,Nulla nisl. Nunc nisl.,2,07/10/2018,Rs.40 Cash Off,Delhi,M2125:EUZWO2
25,Yabox,image/png,Food & Dining,76,"Fusce lacus purus, aliquet at, feugiat non, pretium quis, lectus. Suspendisse potenti.",3,21/10/2018,Rs.500 Cashback,Vadodara,K6758:ON8QHY
26,Muxo,image/gif,Recharge,97,Nunc purus.,2,18/10/2018,50% Discount,Bengaluru,P0380:079W44
27,Dabtype,image/x-tiff,Computers,15,Donec vitae nisi.,5,22/09/2018,Rs.50 Cashback,Indore,O5465:96P0JL
28,Mita,image/gif,Computers,78,Morbi porttitor lorem id ligula.,0,03/10/2018,90% Discount,Lucknow,K3853:59H8FX
29,Jabbercube,image/pjpeg,Beauty & Health,1,Vivamus vel nulla eget eros elementum pellentesque.,1,15/09/2018,Rs.80 Cash Off,Navi Mumbai,D8119:WICKTG
30,Jayo,image/x-tiff,Recharge,72,"Nullam orci pede, venenatis non, sodales sed, tincidunt eu, felis.",2,12/10/2018,20% Discount,Dombivli,B1466:30LQPX
31,Fivespan,image/tiff,TV/Audio/Video & Movies,86,Integer ac neque.,1,22/10/2018,Rs.30 Cash Off,Guwahati,S7109:G835P1
32,Skidoo,image/gif,Mobiles & Tablets,63,Donec quis orci eget orci vehicula condimentum.,2,12/10/2018,Rs.50 Cashback,Gwalior,Q5451:2TYFG7
33,Divanoodle,image/pjpeg,Laptops & Gaming,37,Nulla tellus.,2,15/10/2018,60% Discount,Kalyan,I5239:RG9U6G
34,Myworks,image/tiff,Mobiles & Tablets,72,"Duis ac nibh. Fusce lacus purus, aliquet at, feugiat non, pretium quis, lectus.",1,21/09/2018,40% Discount,Hyderabad,Q2523:RBMQ8S
35,Shuffledrive,image/png,Home Furnishing & Decor,99,Curabitur at ipsum ac tellus semper interdum.,4,10/10/2018,Rs.20 Cash Off,Hyderabad,B6599:8ECVAN
36,Fatz,image/tiff,Computers,86,Maecenas ut massa quis augue luctus tincidunt.,0,16/09/2018,Rs.500 Cash Off,Kalyan,L6838:HA0AZV
37,Tagcat,image/gif,Laptops & Gaming,59,Nulla nisl.,1,16/09/2018,20% Discount,Thane,E5021:O9SHEU
38,Zoomlounge,image/jpeg,Laptops & Gaming,42,Cras non velit nec nisi vulputate nonummy. Maecenas tincidunt lacus at velit.,3,21/09/2018,Rs.400 Cash Off,Srinagar,R5192:PHYOOO
39,Jabbersphere,image/tiff,Laptops & Gaming,12,Proin interdum mauris non ligula pellentesque ultrices.,2,18/09/2018,Rs.30 Cash Off,Surat,G9310:6UBY4Y
40,Gigazoom,image/jpeg,Fashion,56,"Nulla neque libero, convallis eget, eleifend luctus, ultricies eu, nibh. Quisque id justo sit amet sapien dignissim vestibulum.",4,17/09/2018,Rs.20 Cash Off,Kolkata,L7487:WE0WJ9
41,Yakijo,image/x-tiff,Fashion,100,Fusce consequat. Nulla nisl.,0,10/10/2018,80% Discount,Chandigarh,D5902:Z5JLXP
42,Blogtag,image/png,TV/Audio/Video & Movies,15,Integer a nibh.,1,21/09/2018,Rs.400 Cashback,Bhopal,G2559:KDJFW5
43,Topicshots,image/x-tiff,Food & Dining,55,"Donec ut mauris eget massa tempor convallis. Nulla neque libero, convallis eget, eleifend luctus, ultricies eu, nibh.",4,30/09/2018,Rs.200 Cashback,Pune,O0670:SKZKZR
44,Snaptags,image/jpeg,Recharge,22,"Nulla ac enim. In tempor, turpis nec euismod scelerisque, quam turpis adipiscing lorem, vitae mattis nibh ligula nec sem.",0,22/09/2018,Rs.40 Cash Off,Amritsar,C1002:8LL70E
45,Feedbug,image/tiff,Beauty & Health,64,Nulla nisl. Nunc nisl.,2,17/09/2018,Rs.40 Cash Off,Pune,N0721:PSFC83
46,Zooxo,image/tiff,Beauty & Health,92,Donec quis orci eget orci vehicula condimentum. Curabitur in libero ut massa volutpat convallis.,5,18/09/2018,Rs.200 Cash Off,Dombivli,C2614:8DTQ85
47,Trilia,image/png,Recharge,32,"Morbi vel lectus in quam fringilla rhoncus. Mauris enim leo, rhoncus sed, vestibulum sit amet, cursus id, turpis.",3,15/09/2018,Rs.60 Cash Off,Chennai,Y5255:9N8T81
48,Buzzshare,image/jpeg,Mobiles & Tablets,9,In blandit ultrices enim.,5,15/10/2018,Rs.20 Cash Off,Chandigarh,W9459:ZVA70Q
49,Viva,image/gif,Food & Dining,39,In quis justo.,1,17/10/2018,60% Discount,Nagpur,Y0688:RF1MNA
50,Brainlounge,image/x-tiff,Recharge,22,"Nam ultrices, libero non mattis pulvinar, nulla pede ullamcorper augue, a suscipit nulla elit ac nulla. Sed vel enim sit amet nunc viverra dapibus.",0,29/09/2018,Rs.300 Cash Off,Pune,K7805:U7A15W
51,Brainbox,image/pjpeg,Food & Dining,4,Maecenas rhoncus aliquam lacus.,5,29/10/2018,Rs.300 Cash Off,Nagpur,M1168:GRIGOD
52,Skajo,image/pjpeg,Entertainment,52,Vestibulum sed magna at nunc commodo placerat.,1,12/09/2018,Rs.500 Cashback,Madurai,S3601:RZACJ7
53,Quinu,image/png,Mobiles & Tablets,69,Vestibulum ac est lacinia nisi venenatis tristique.,4,11/10/2018,Rs.50 Cash Off,Tirunelveli,P8327:L9WE6H
54,Blogtags,image/jpeg,Mobiles & Tablets,93,"Morbi vestibulum, velit id pretium iaculis, diam erat fermentum justo, nec condimentum neque sapien placerat ante. Nulla justo.",3,25/09/2018,Rs.10 Cash Off,Kolkata,U8134:5AYF5G
55,Jabberstorm,image/jpeg,Home Furnishing & Decor,41,Vestibulum ante ipsum primis in faucibus orci luctus et ultrices posuere cubilia Curae; Duis faucibus accumsan odio.,4,11/10/2018,30% Discount,Ghaziabad,P0407:PS0UII
56,Fiveclub,image/png,Laptops & Gaming,45,"Cum sociis natoque penatibus et magnis dis parturient montes, nascetur ridiculus mus. Etiam vel augue.",5,23/09/2018,30% Discount,Jaipur,X5664:YSHAWT
57,Photolist,image/png,Entertainment,70,"Morbi ut odio. Cras mi pede, malesuada in, imperdiet et, commodo vulputate, justo.",0,16/09/2018,Rs.30 Cash Off,Shivaji Nagar,G8859:H35020
58,Eadel,image/tiff,Laptops & Gaming,34,Suspendisse potenti. Nullam porttitor lacus at turpis.,3,25/10/2018,Rs.20 Cash Off,Ahmedabad,E8113:Q8ON3Z
59,Eimbee,image/x-tiff,Food & Dining,14,Suspendisse accumsan tortor quis turpis. Sed ante.,0,01/10/2018,Rs.400 Cashback,Kalyan,Q9523:JOFHVU
60,Devshare,image/tiff,Computers,50,Cras non velit nec nisi vulputate nonummy. Maecenas tincidunt lacus at velit.,5,24/09/2018,FREE,Tirunelveli,R4877:L9WVL5
61,Youbridge,image/tiff,Entertainment,44,"Fusce lacus purus, aliquet at, feugiat non, pretium quis, lectus. Suspendisse potenti.",4,21/10/2018,Rs.70 Cash Off,Tirunelveli,P3857:F5TQS1
62,Linkbridge,image/png,Computers,52,Phasellus in felis.,3,29/09/2018,60% Discount,Agra,F8404:D9YQP9
63,Kwilith,image/png,TV/Audio/Video & Movies,1,Proin at turpis a pede posuere nonummy.,5,22/10/2018,90% Discount,Teni,X3207:I2NHZH
64,Twitterbeat,image/pjpeg,Mobiles & Tablets,28,"Fusce lacus purus, aliquet at, feugiat non, pretium quis, lectus.",5,21/09/2018,Rs.200 Cashback,Varanasi,J3193:VAWYWR
65,Rooxo,image/gif,Computers,5,Vivamus vel nulla eget eros elementum pellentesque. Quisque porta volutpat erat.,3,01/10/2018,Rs.500 Cash Off,Gorakhpur,J2709:GBCNK6
66,Yabox,image/x-tiff,Home Furnishing & Decor,2,Nunc rhoncus dui vel sem.,3,21/10/2018,Rs.200 Cashback,Kanpur,B1174:CVKVEK
67,Centizu,image/gif,Recharge,46,Donec dapibus. Duis at velit eu est congue elementum.,4,28/09/2018,FREE,Teni,M6100:660GPE
68,Feedmix,image/pjpeg,Home Furnishing & Decor,62,Nulla ut erat id mauris vulputate elementum.,5,04/10/2018,20% Discount,Guwahati,D6679:AN7HD6
69,Quaxo,image/x-tiff,Laptops & Gaming,87,Proin eu mi. Nulla ac enim.,2,28/09/2018,Rs.400 Cash Off,Srinagar,U1359:EAM3TY
70,Cogilith,image/x-tiff,Fashion,76,Curabitur at ipsum ac tellus semper interdum.,5,16/09/2018,30% Discount,Allahabad,S5451:MWBVOI
71,Pixope,image/png,Home Furnishing & Decor,37,Etiam vel augue. Vestibulum rutrum rutrum neque.,5,06/10/2018,10% Discount,Nashik,O8033:DM6KFI
72,Realmix,image/pjpeg,Food & Dining,52,"Nulla ac enim. In tempor, turpis nec euismod scelerisque, quam turpis adipiscing lorem, vitae mattis nibh ligula nec sem.",3,18/10/2018,40% Discount,Nashik,K4576:N56AP9
73,Wikido,image/jpeg,TV/Audio/Video & Movies,63,"Morbi vel lectus in quam fringilla rhoncus. Mauris enim leo, rhoncus sed, vestibulum sit amet, cursus id, turpis.",3,17/10/2018,Rs.300 Cash Off,Thane,V7212:IJ97IZ
74,Topdrive,image/jpeg,Entertainment,58,"Vestibulum ante ipsum primis in faucibus orci luctus et ultrices posuere cubilia Curae; Nulla dapibus dolor vel est. Donec odio justo, sollicitudin ut, suscipit a, feugiat et, eros.",2,16/09/2018,Rs.80 Cash Off,Mumbai,V9385:UCGA89
75,Twinder,image/gif,Beauty & Health,68,Donec quis orci eget orci vehicula condimentum.,0,22/09/2018,Rs.400 Cash Off,Solapur,O3434:BROUWM
76,Oyope,image/gif,Mobiles & Tablets,75,Fusce consequat. Nulla nisl.,5,13/09/2018,Rs.50 Cashback,Madurai,I9874:7O969L
77,Gigashots,image/pjpeg,Laptops & Gaming,29,Vestibulum ante ipsum primis in faucibus orci luctus et ultrices posuere cubilia Curae; Duis faucibus accumsan odio. Curabitur convallis.,0,24/10/2018,Rs.60 Cash Off,Mumbai,D1209:DJ2TUF
78,Wordify,image/jpeg,Food & Dining,9,"Cum sociis natoque penatibus et magnis dis parturient montes, nascetur ridiculus mus. Vivamus vestibulum sagittis sapien.",4,02/10/2018,Rs.50 Cash Off,Jaipur,U3695:F42EET
79,Buzzster,image/pjpeg,Home Furnishing & Decor,75,In hac habitasse platea dictumst.,1,01/10/2018,Rs.50 Cashback,Haora,E7525:BR2AC0
80,Podcat,image/x-tiff,Recharge,73,"Morbi vestibulum, velit id pretium iaculis, diam erat fermentum justo, nec condimentum neque sapien placerat ante.",4,17/09/2018,40% Discount,Patna,R8512:3LUGK7
81,Edgeblab,image/gif,Mobiles & Tablets,15,"Integer aliquet, massa id lobortis convallis, tortor risus dapibus augue, vel accumsan tellus nisi eu orci.",2,12/10/2018,Rs.400 Cashback,Delhi,F1499:N30WX7
82,Oloo,image/gif,Recharge,45,Vestibulum ac est lacinia nisi venenatis tristique.,5,30/10/2018,Rs.50 Cash Off,Agra,F8283:IDBW0T
83,Kaymbo,image/jpeg,Entertainment,12,"Nullam orci pede, venenatis non, sodales sed, tincidunt eu, felis.",4,24/10/2018,Rs.500 Cashback,Kalyan,Z7531:YQJXB0
84,Jetpulse,image/pjpeg,Laptops & Gaming,42,Sed sagittis.,2,16/10/2018,50% Discount,Faridabad,P0371:S4WDKO
85,Kwideo,image/png,TV/Audio/Video & Movies,98,Nam nulla.,3,21/10/2018,Rs.80 Cash Off,Bhopal,T8449:EH76IB
86,Skilith,image/png,Laptops & Gaming,5,Integer ac neque.,5,14/09/2018,Rs.300 Cash Off,Hyderabad,J4509:E3B6I9
87,Feedbug,image/pjpeg,Fashion,8,Ut tellus.,5,23/09/2018,Rs.60 Cash Off,Chennai,O6954:OZ52XL
88,Rhybox,image/gif,Home Furnishing & Decor,56,Donec posuere metus vitae ipsum.,1,25/09/2018,Rs.200 Cashback,Kolkata,S5482:GHZHQO
89,Skyndu,image/jpeg,Entertainment,19,Nulla mollis molestie lorem. Quisque ut erat.,1,22/09/2018,Rs.40 Cash Off,Nagpur,L8980:PMK37C
90,Eimbee,image/tiff,Laptops & Gaming,14,Morbi non lectus. Aliquam sit amet diam in magna bibendum imperdiet.,0,25/09/2018,40% Discount,Vijayawada,P5946:K99PL5
91,Skinix,image/png,Fashion,94,"Morbi vel lectus in quam fringilla rhoncus. Mauris enim leo, rhoncus sed, vestibulum sit amet, cursus id, turpis.",0,08/10/2018,FREE,Gwalior,H0631:EQLYZR
92,Realbuzz,image/png,Beauty & Health,98,In eleifend quam a odio.,3,13/09/2018,Rs.300 Cash Off,Srinagar,M2349:84CZL1
93,Tagtune,image/x-tiff,TV/Audio/Video & Movies,50,"Fusce posuere felis sed lacus. Morbi sem mauris, laoreet ut, rhoncus aliquet, pulvinar sed, nisl.",5,12/10/2018,50% Discount,Tirunelveli,P3526:QDAQER
94,Blognation,image/x-tiff,Recharge,83,"Mauris enim leo, rhoncus sed, vestibulum sit amet, cursus id, turpis. Integer aliquet, massa id lobortis convallis, tortor risus dapibus augue, vel accumsan tellus nisi eu orci.",5,30/10/2018,Rs.100 Cashback,Patna,E2380:H4HQY1
95,Flipstorm,image/tiff,Mobiles & Tablets,40,"Morbi sem mauris, laoreet ut, rhoncus aliquet, pulvinar sed, nisl. Nunc rhoncus dui vel sem.",2,22/10/2018,Rs.60 Cash Off,Nashik,C8893:GS08PU
96,Skilith,image/jpeg,Entertainment,96,Aliquam non mauris.,0,10/10/2018,Rs.100 Cashback,Meerut,T0229:H4DEEV
97,Dabjam,image/tiff,Mobiles & Tablets,80,"Duis bibendum, felis sed interdum venenatis, turpis enim blandit mi, in porttitor pede justo eu massa. Donec dapibus.",4,24/09/2018,Rs.300 Cash Off,Mumbai,I4442:AQAF4B
98,Gabtype,image/x-tiff,Fashion,22,Praesent blandit lacinia erat.,4,12/10/2018,Rs.90 Cash Off,Hyderabad,I9526:DRBX1K
99,Realpoint,image/png,Beauty & Health,2,"Quisque erat eros, viverra eget, congue eget, semper rutrum, nulla.",3,29/10/2018,Rs.90 Cash Off,Vijayawada,R3175:SXRJIL
100,Zoonder,image/x-tiff,Mobiles & Tablets,78,Nulla tellus. In sagittis dui vel nisl.,1,30/10/2018,Rs.400 Cash Off,Meerut,V6998:4M55YU
101,Jabberbean,image/gif,Home Furnishing & Decor,85,"Curabitur in libero ut massa volutpat convallis. Morbi odio odio, elementum eu, interdum eu, tincidunt in, leo.",5,25/10/2018,50% Discount,Indore,X9007:QZ45UG
102,Feedbug,image/tiff,Food & Dining,94,Maecenas ut massa quis augue luctus tincidunt.,0,27/09/2018,Rs.400 Cashback,Visakhapatnam,Q8831:ETM0DF
103,Flashset,image/x-tiff,Recharge,24,"Morbi sem mauris, laoreet ut, rhoncus aliquet, pulvinar sed, nisl.",4,06/10/2018,Rs.80 Cash Off,Dombivli,V1501:O6KE1B
104,Babbleopia,image/pjpeg,Beauty & Health,50,Nullam molestie nibh in lectus.,1,21/10/2018,Rs.100 Cashback,Aurangabad,Y4107:2E1PN7
105,Lazz,image/png,Beauty & Health,2,Sed sagittis.,5,06/10/2018,Rs.200 Cashback,Shivaji Nagar,F0904:WP9FYX
106,InnoZ,image/tiff,TV/Audio/Video & Movies,68,Duis aliquam convallis nunc. Proin at turpis a pede posuere nonummy.,5,22/09/2018,40% Discount,Delhi,X7057:ABBZC6
107,Bubbletube,image/jpeg,Beauty & Health,71,"In hac habitasse platea dictumst. Morbi vestibulum, velit id pretium iaculis, diam erat fermentum justo, nec condimentum neque sapien placerat ante.",2,19/10/2018,Rs.50 Cash Off,Varanasi,Y6264:BPKSB9
108,Rooxo,image/jpeg,Food & Dining,57,Nunc purus. Phasellus in felis.,3,26/09/2018,Rs.50 Cashback,Visakhapatnam,W5740:V3ON76
109,Jabberstorm,image/jpeg,TV/Audio/Video & Movies,65,Aliquam non mauris.,4,27/09/2018,Rs.70 Cash Off,Faridabad,V9970:JS1587
110,Voonyx,image/jpeg,Entertainment,27,Praesent id massa id nisl venenatis lacinia.,3,24/10/2018,Rs.400 Cashback,Kolkata,A8671:ZP8440
111,Npath,image/pjpeg,Entertainment,38,"Vestibulum ante ipsum primis in faucibus orci luctus et ultrices posuere cubilia Curae; Donec pharetra, magna vestibulum aliquet ultrices, erat tortor sollicitudin mi, sit amet lobortis sapien sapien non mi.",2,28/10/2018,Rs.300 Cashback,Ahmedabad,R1163:97DI2T
112,Topicware,image/gif,Recharge,43,Maecenas rhoncus aliquam lacus.,1,30/09/2018,80% Discount,Indore,L9808:HPG4S5
113,Fivespan,image/jpeg,Fashion,20,Integer a nibh.,3,16/09/2018,Rs.70 Cash Off,Indore,H8834:B8Y6XH
114,Tagtune,image/png,Recharge,50,Vestibulum ante ipsum primis in faucibus orci luctus et ultrices posuere cubilia Curae; Nulla dapibus dolor vel est.,0,06/10/2018,Rs.300 Cashback,Solapur,B4477:GAFZPA
115,Skibox,image/pjpeg,Computers,23,"Cum sociis natoque penatibus et magnis dis parturient montes, nascetur ridiculus mus.",1,01/10/2018,90% Discount,Chennai,V6773:QSIX8G
116,Einti,image/jpeg,Mobiles & Tablets,1,"Duis ac nibh. Fusce lacus purus, aliquet at, feugiat non, pretium quis, lectus.",1,19/10/2018,Rs.300 Cashback,Navi Mumbai,E9965:UPNU50
117,Yoveo,image/png,TV/Audio/Video & Movies,85,In eleifend quam a odio.,1,18/10/2018,20% Discount,Kanpur,J0220:L269KA
118,Roomm,image/tiff,Entertainment,52,Integer ac neque. Duis bibendum.,3,29/10/2018,Rs.300 Cashback,Tirunelveli,D9870:NHII90
119,Minyx,image/png,Fashion,74,Sed vel enim sit amet nunc viverra dapibus.,2,17/09/2018,Rs.500 Cash Off,Haora,V6239:F3E060
120,Mynte,image/pjpeg,Mobiles & Tablets,72,Etiam justo. Etiam pretium iaculis justo.,0,24/10/2018,Rs.40 Cash Off,Ghaziabad,K1989:ATVR15
121,Devpoint,image/tiff,Laptops & Gaming,33,Phasellus sit amet erat.,2,09/10/2018,Rs.60 Cash Off,Nowrangapur,K0204:TFUZI0
122,Shuffledrive,image/png,Food & Dining,100,Aliquam quis turpis eget elit sodales scelerisque.,0,07/10/2018,Rs.90 Cash Off,Teni,G6784:H98DLP
123,Mydo,image/jpeg,Food & Dining,57,Morbi porttitor lorem id ligula. Suspendisse ornare consequat lectus.,1,02/10/2018,70% Discount,Varanasi,M5776:W9JSJG
124,Oyoloo,image/jpeg,Entertainment,12,"In est risus, auctor sed, tristique in, tempus sit amet, sem. Fusce consequat.",3,28/10/2018,FREE,Agra,Z3660:H4G8N1
125,Bluezoom,image/tiff,Recharge,60,Nulla tellus.,3,20/10/2018,Rs.400 Cash Off,Bengaluru,B8731:M9KW63
126,Oloo,image/jpeg,Mobiles & Tablets,10,"Nam congue, risus semper porta volutpat, quam pede lobortis ligula, sit amet eleifend pede libero quis orci.",0,04/10/2018,Rs.70 Cash Off,Mumbai,U8751:F511IP
127,Quinu,image/pjpeg,Recharge,73,"Nulla neque libero, convallis eget, eleifend luctus, ultricies eu, nibh. Quisque id justo sit amet sapien dignissim vestibulum.",5,25/10/2018,60% Discount,Delhi,Z9592:0IHKHJ
128,Mybuzz,image/gif,Computers,17,Donec ut mauris eget massa tempor convallis.,0,11/10/2018,Rs.20 Cash Off,Lucknow,K1507:E7Q0TE
129,Voolia,image/jpeg,Laptops & Gaming,76,"Maecenas leo odio, condimentum id, luctus nec, molestie sed, justo. Pellentesque viverra pede ac diam.",0,22/09/2018,20% Discount,Kanpur,N8520:G9EYR3
130,Browsetype,image/x-tiff,Fashion,9,"Cum sociis natoque penatibus et magnis dis parturient montes, nascetur ridiculus mus. Vivamus vestibulum sagittis sapien.",5,23/09/2018,Rs.50 Cashback,Delhi,O6220:ZF2NYT
131,Bubblemix,image/tiff,Food & Dining,28,"Lorem ipsum dolor sit amet, consectetuer adipiscing elit. Proin interdum mauris non ligula pellentesque ultrices.",4,12/10/2018,Rs.20 Cash Off,Kalyan,M6693:LHNWM8
132,Snaptags,image/png,Beauty & Health,19,Curabitur at ipsum ac tellus semper interdum.,3,01/10/2018,Rs.200 Cashback,Allahabad,P3470:UK87CD
133,Jaxnation,image/tiff,Home Furnishing & Decor,32,"Nam congue, risus semper porta volutpat, quam pede lobortis ligula, sit amet eleifend pede libero quis orci. Nullam molestie nibh in lectus.",5,23/09/2018,90% Discount,Gwalior,E0769:4LH555
134,Thoughtmix,image/tiff,Laptops & Gaming,25,"Morbi sem mauris, laoreet ut, rhoncus aliquet, pulvinar sed, nisl. Nunc rhoncus dui vel sem.",0,12/09/2018,Rs.100 Cash Off,Faridabad,L9396:36RJGK
135,Brightbean,image/jpeg,Recharge,42,Phasellus sit amet erat. Nulla tempus.,5,08/10/2018,Rs.80 Cash Off,Tirunelveli,B1475:X01VRQ
136,Vitz,image/jpeg,Laptops & Gaming,54,"Lorem ipsum dolor sit amet, consectetuer adipiscing elit.",0,12/10/2018,20% Discount,Navi Mumbai,E8420:BM8BRM
137,Skaboo,image/x-tiff,Computers,65,Duis at velit eu est congue elementum.,1,18/09/2018,Rs.100 Cash Off,Jodhpur,K5809:4HJMSY
138,Fliptune,image/pjpeg,Fashion,73,"Mauris enim leo, rhoncus sed, vestibulum sit amet, cursus id, turpis. Integer aliquet, massa id lobortis convallis, tortor risus dapibus augue, vel accumsan tellus nisi eu orci.",0,06/10/2018,60% Discount,Ghaziabad,R1158:4SOZXN
139,Feedbug,image/x-tiff,Home Furnishing & Decor,45,Etiam justo. Etiam pretium iaculis justo.,2,21/09/2018,FREE,Bengaluru,Q8615:5IXC5B
140,Jabbersphere,image/gif,Home Furnishing & Decor,45,Quisque ut erat. Curabitur gravida nisi at nibh.,1,03/10/2018,80% Discount,Jabalpur,N9285:A2GTNB
141,Gigazoom,image/jpeg,Fashion,13,Duis aliquam convallis nunc. Proin at turpis a pede posuere nonummy.,0,19/10/2018,Rs.300 Cashback,Teni,X8972:XF560T
142,Meetz,image/png,Beauty & Health,91,"Lorem ipsum dolor sit amet, consectetuer adipiscing elit. Proin interdum mauris non ligula pellentesque ultrices.",5,25/09/2018,Rs.80 Cash Off,Tirunelveli,R4570:BUGSPQ
143,DabZ,image/png,Laptops & Gaming,4,Pellentesque eget nunc.,3,23/10/2018,80% Discount,Gorakhpur,Q2507:RHCCCP
144,Blogtags,image/tiff,Entertainment,94,Donec posuere metus vitae ipsum.,4,12/09/2018,Rs.50 Cashback,Visakhapatnam,X4239:6WT8ZW
145,Abata,image/tiff,Fashion,55,Nulla mollis molestie lorem. Quisque ut erat.,2,07/10/2018,Rs.100 Cashback,Chennai,E8497:EUQ3QD
146,Mybuzz,image/png,Fashion,10,Maecenas tincidunt lacus at velit.,5,19/10/2018,50% Discount,Bhopal,R7556:DDV36D
147,Meevee,image/tiff,Beauty & Health,46,Morbi vel lectus in quam fringilla rhoncus.,0,19/09/2018,Rs.30 Cash Off,Gorakhpur,Q3320:SGOZL9
148,Eabox,image/tiff,Recharge,60,"Integer aliquet, massa id lobortis convallis, tortor risus dapibus augue, vel accumsan tellus nisi eu orci.",4,19/10/2018,Rs.90 Cash Off,Nowrangapur,T3463:8LOKZT
149,JumpXS,image/png,Fashion,82,Aenean sit amet justo.,2,01/10/2018,20% Discount,Indore,T5685:LSESXC
150,Edgepulse,image/x-tiff,Laptops & Gaming,52,Pellentesque ultrices mattis odio.,3,16/09/2018,Rs.500 Cash Off,Aurangabad,U8074:JJGH4D
151,Thoughtworks,image/tiff,Fashion,87,Quisque ut erat.,1,29/10/2018,Rs.40 Cash Off,Jaipur,E1218:QZEDC1
152,Feedfire,image/gif,Home Furnishing & Decor,27,"Quisque arcu libero, rutrum ac, lobortis vel, dapibus at, diam. Nam tristique tortor eu pede.",0,12/09/2018,90% Discount,Madurai,M4636:AAC7AI
153,Yakijo,image/gif,Mobiles & Tablets,86,"Fusce lacus purus, aliquet at, feugiat non, pretium quis, lectus. Suspendisse potenti.",2,07/10/2018,Rs.60 Cash Off,Jodhpur,J0911:YPHW1O
154,Zoomlounge,image/x-tiff,Mobiles & Tablets,100,"Curabitur in libero ut massa volutpat convallis. Morbi odio odio, elementum eu, interdum eu, tincidunt in, leo.",1,26/09/2018,20% Discount,Lucknow,D3933:UGHZ9S
155,Vitz,image/gif,Home Furnishing & Decor,60,Aenean auctor gravida sem.,5,27/09/2018,Rs.400 Cash Off,Indore,S2148:BPJ1OJ
156,Tazzy,image/pjpeg,Beauty & Health,99,Mauris sit amet eros.,5,05/10/2018,40% Discount,Lucknow,X0170:ZT85RU
157,Topiclounge,image/tiff,Beauty & Health,86,"Vestibulum quam sapien, varius ut, blandit non, interdum in, ante. Vestibulum ante ipsum primis in faucibus orci luctus et ultrices posuere cubilia Curae; Duis faucibus accumsan odio.",3,26/09/2018,Rs.50 Cash Off,Ghaziabad,S3996:GNPLZY
158,Rhynyx,image/gif,Mobiles & Tablets,70,"Nam dui. Proin leo odio, porttitor id, consequat in, consequat ut, nulla.",1,22/09/2018,FREE,Mumbai,G2790:HIR1JT
159,Rhyloo,image/x-tiff,Laptops & Gaming,31,Cras in purus eu magna vulputate luctus.,2,01/10/2018,70% Discount,Aurangabad,K2491:SPM0AH
160,Skyba,image/gif,Beauty & Health,18,Quisque porta volutpat erat.,1,26/10/2018,80% Discount,Navi Mumbai,D2250:37YEP4
161,Youbridge,image/gif,Laptops & Gaming,100,Suspendisse potenti.,2,06/10/2018,Rs.50 Cashback,Agra,C2080:20P94J
162,Devbug,image/gif,Recharge,44,Fusce consequat. Nulla nisl.,1,19/10/2018,Rs.50 Cashback,Faridabad,Z9076:9YW2EN
163,Photofeed,image/png,Fashion,75,Proin at turpis a pede posuere nonummy. Integer non velit.,1,25/09/2018,Rs.200 Cash Off,Coimbatore,Y0890:Y117TV
164,Dynazzy,image/pjpeg,Computers,95,Vivamus tortor.,2,29/10/2018,10% Discount,Srinagar,L0861:RD0V2V
165,Skinte,image/png,Beauty & Health,37,Duis at velit eu est congue elementum. In hac habitasse platea dictumst.,0,28/10/2018,Rs.30 Cash Off,Chennai,X6496:3RU3MS
166,Lajo,image/tiff,Entertainment,90,Vestibulum ante ipsum primis in faucibus orci luctus et ultrices posuere cubilia Curae; Duis faucibus accumsan odio.,3,05/10/2018,Rs.400 Cash Off,Mumbai,P5542:PYC05P
167,Devcast,image/pjpeg,Mobiles & Tablets,20,"Donec odio justo, sollicitudin ut, suscipit a, feugiat et, eros.",3,29/10/2018,Rs.50 Cash Off,Delhi,N2210:9K33G1
