_id,name,logo,category,used,details,reviews,expires_on,type,location,code
333,Oba,image/pjpeg,Mobiles & Tablets,64,Morbi ut odio.,2,28/09/2018,Rs.90 Cash Off,Pune,G8315:ORVC25
334,Jabbersphere,image/gif,Mobiles & Tablets,16,"Morbi odio odio, elementum eu, interdum eu, tincidunt in, leo. Maecenas pulvinar lobortis est.",4,12/09/2018,30% Discount,Ghaziabad,X2489:O65N1Z
335,Skibox,image/jpeg,TV/Audio/Video & Movies,23,Vestibulum ac est lacinia nisi venenatis tristique.,4,21/10/2018,80% Discount,Vijayawada,I1773:FGLG9J
336,Buzzbean,image/jpeg,Food & Dining,75,Sed sagittis.,1,14/09/2018,40% Discount,Srinagar,T7129:5GO0WY
337,Gabtune,image/jpeg,Entertainment,16,Sed ante. Vivamus tortor.,0,11/10/2018,90% Discount,Visakhapatnam,J4980:183RJP
338,Youbridge,image/x-tiff,Home Furnishing & Decor,45,Nulla ut erat id mauris vulputate elementum.,0,14/09/2018,40% Discount,Allahabad,R7489:WSQUY4
339,Cogibox,image/tiff,Home Furnishing & Decor,3,"Mauris enim leo, rhoncus sed, vestibulum sit amet, cursus id, turpis. Integer aliquet, massa id lobortis convallis, tortor risus dapibus augue, vel accumsan tellus nisi eu orci.",5,30/09/2018,70% Discount,Agra,I2453:45WZUG
340,Myworks,image/pjpeg,Beauty & Health,64,"Morbi odio odio, elementum eu, interdum eu, tincidunt in, leo.",1,24/10/2018,Rs.200 Cash Off,Bengaluru,X8248:H9CQL1
341,Pixonyx,image/x-tiff,Beauty & Health,71,Curabitur in libero ut massa volutpat convallis.,3,01/10/2018,20% Discount,Nashik,B7991:MN35MA
342,Realcube,image/png,TV/Audio/Video & Movies,73,"Fusce congue, diam id ornare imperdiet, sapien urna pretium nisl, ut volutpat sapien arcu sed augue.",2,15/10/2018,Rs.70 Cash Off,Chandigarh,G6306:N9MJY4
343,Linkbridge,image/x-tiff,Food & Dining,19,Integer a nibh. In quis justo.,3,14/10/2018,FREE,Hyderabad,I2232:F4MLD6
344,Feedbug,image/x-tiff,Entertainment,100,Nulla justo. Aliquam quis turpis eget elit sodales scelerisque.,2,17/10/2018,20% Discount,Dombivli,I5624:O4QONT
345,Geba,image/png,Beauty & Health,5,"Donec ut mauris eget massa tempor convallis. Nulla neque libero, convallis eget, eleifend luctus, ultricies eu, nibh.",4,21/09/2018,FREE,Chandigarh,A7553:XU0KME
346,Kazio,image/tiff,Fashion,32,Proin interdum mauris non ligula pellentesque ultrices. Phasellus id sapien in sapien iaculis congue.,3,03/10/2018,10% Discount,Delhi,X1158:7FOUOH
347,Kamba,image/x-tiff,Laptops & Gaming,32,Nulla nisl. Nunc nisl.,4,24/09/2018,Rs.300 Cash Off,Rajkot,F7605:ST8H2X
348,Cogidoo,image/tiff,Laptops & Gaming,76,Phasellus id sapien in sapien iaculis congue.,3,16/09/2018,FREE,Aurangabad,N2509:04KBC3
349,Yoveo,image/jpeg,Food & Dining,78,Nulla facilisi.,5,06/10/2018,Rs.300 Cash Off,Amritsar,D7278:DZ1SW2
350,Voonte,image/jpeg,Mobiles & Tablets,50,Vivamus tortor. Duis mattis egestas metus.,0,22/09/2018,40% Discount,Guwahati,K3757:Z6WZNL
351,Skilith,image/tiff,TV/Audio/Video & Movies,25,Etiam vel augue. Vestibulum rutrum rutrum neque.,2,18/09/2018,Rs.200 Cashback,Patna,E3062:JVAHQV
352,Wikizz,image/gif,Home Furnishing & Decor,31,"Praesent lectus. Vestibulum quam sapien, varius ut, blandit non, interdum in, ante.",2,15/09/2018,Rs.50 Cash Off,Navi Mumbai,W2518:6PQ8I7
353,Fadeo,image/tiff,Laptops & Gaming,92,"Curabitur in libero ut massa volutpat convallis. Morbi odio odio, elementum eu, interdum eu, tincidunt in, leo.",2,18/10/2018,Rs.50 Cash Off,Patna,N8027:MJAFU6
354,Youopia,image/tiff,Computers,91,Integer tincidunt ante vel ipsum.,1,13/09/2018,Rs.200 Cash Off,Agra,R6839:FHJ5SX
355,Browsetype,image/x-tiff,TV/Audio/Video & Movies,15,"Morbi sem mauris, laoreet ut, rhoncus aliquet, pulvinar sed, nisl. Nunc rhoncus dui vel sem.",4,10/10/2018,Rs.50 Cashback,Jodhpur,M9083:1B4CQE
356,Twinte,image/jpeg,Beauty & Health,60,"Aliquam sit amet diam in magna bibendum imperdiet. Nullam orci pede, venenatis non, sodales sed, tincidunt eu, felis.",3,23/10/2018,50% Discount,Varanasi,N4994:JVNCYS
357,Zoonoodle,image/gif,Laptops & Gaming,2,In eleifend quam a odio. In hac habitasse platea dictumst.,3,16/09/2018,Rs.40 Cash Off,Surat,S1290:90GR1N
358,Voolia,image/gif,Entertainment,59,"Lorem ipsum dolor sit amet, consectetuer adipiscing elit. Proin interdum mauris non ligula pellentesque ultrices.",0,17/09/2018,10% Discount,Kanpur,X6969:FUX8IX
359,Zoonder,image/jpeg,Beauty & Health,69,Sed ante. Vivamus tortor.,5,02/10/2018,70% Discount,Faridabad,B2084:0VWARE
360,Oyonder,image/png,Mobiles & Tablets,48,"Nullam orci pede, venenatis non, sodales sed, tincidunt eu, felis. Fusce posuere felis sed lacus.",0,29/10/2018,70% Discount,Allahabad,O7801:45WO6N
361,Dabshots,image/x-tiff,Food & Dining,55,In sagittis dui vel nisl.,0,21/10/2018,Rs.20 Cash Off,Gwalior,Y1036:1Z3I47
362,Oyoyo,image/gif,Mobiles & Tablets,70,Nulla nisl. Nunc nisl.,2,10/10/2018,Rs.500 Cashback,Pune,M0182:07O7OU
363,Zoombox,image/pjpeg,Home Furnishing & Decor,43,"Lorem ipsum dolor sit amet, consectetuer adipiscing elit. Proin risus.",0,22/09/2018,Rs.300 Cashback,Chennai,P3426:K6GEDG
364,Yotz,image/x-tiff,Home Furnishing & Decor,29,Nullam sit amet turpis elementum ligula vehicula consequat.,0,14/10/2018,Rs.100 Cashback,Nowrangapur,H2747:CSMUPV
365,Tekfly,image/x-tiff,Home Furnishing & Decor,25,Ut at dolor quis odio consequat varius. Integer ac leo.,3,10/10/2018,70% Discount,Chennai,F2106:KTFW4I
366,Oyoyo,image/jpeg,Computers,43,Nulla nisl. Nunc nisl.,5,17/10/2018,FREE,Gwalior,O2738:OJUQ61
367,Gevee,image/gif,Home Furnishing & Decor,94,Mauris sit amet eros.,2,22/10/2018,Rs.400 Cash Off,Chennai,T2796:7N50RH
368,Skyble,image/tiff,Recharge,85,Sed ante.,5,18/10/2018,Rs.400 Cash Off,Gwalior,U9819:5VAGR7
369,Edgeclub,image/png,Food & Dining,82,Pellentesque eget nunc.,1,14/09/2018,Rs.300 Cashback,Agra,J9314:3K3PHQ
370,Jaxnation,image/png,TV/Audio/Video & Movies,48,"Duis ac nibh. Fusce lacus purus, aliquet at, feugiat non, pretium quis, lectus.",3,23/10/2018,Rs.50 Cashback,Rajkot,M2812:DXJYG4
371,Thoughtblab,image/png,TV/Audio/Video & Movies,49,Sed vel enim sit amet nunc viverra dapibus. Nulla suscipit ligula in lacus.,2,13/09/2018,Rs.500 Cash Off,Pimpri,Y5799:F1DK2M
372,Gigazoom,image/png,Fashion,60,"Lorem ipsum dolor sit amet, consectetuer adipiscing elit. Proin risus.",0,24/09/2018,Rs.200 Cash Off,Faridabad,X8505:RD3XFV
373,Yoveo,image/tiff,TV/Audio/Video & Movies,28,Quisque porta volutpat erat.,0,17/10/2018,Rs.10 Cash Off,Indore,E9093:2MHVCN
374,Devshare,image/pjpeg,Beauty & Health,48,Proin risus. Praesent lectus.,4,04/10/2018,Rs.500 Cash Off,Bengaluru,J3316:1C7MW4
375,Edgepulse,image/x-tiff,Beauty & Health,100,Proin at turpis a pede posuere nonummy. Integer non velit.,0,20/10/2018,Rs.400 Cash Off,Nowrangapur,I3555:ZJEJPB
376,Voonder,image/png,Home Furnishing & Decor,16,Proin eu mi.,3,22/09/2018,Rs.100 Cashback,Patna,O1073:GDHWFX
377,Oyoloo,image/png,TV/Audio/Video & Movies,18,Suspendisse ornare consequat lectus.,2,23/10/2018,Rs.20 Cash Off,Lucknow,F4067:O15U7X
378,Tagchat,image/jpeg,Entertainment,49,Maecenas tincidunt lacus at velit. Vivamus vel nulla eget eros elementum pellentesque.,0,22/09/2018,60% Discount,Ghaziabad,A0517:Z76KJR
379,Jabbersphere,image/x-tiff,Recharge,11,Etiam vel augue. Vestibulum rutrum rutrum neque.,0,05/10/2018,Rs.300 Cash Off,Gorakhpur,E3934:NC7VPP
380,Flashset,image/png,Laptops & Gaming,21,"Cras mi pede, malesuada in, imperdiet et, commodo vulputate, justo.",5,19/09/2018,80% Discount,Nowrangapur,A3352:3UJP0P
381,Blognation,image/png,Laptops & Gaming,43,"Donec odio justo, sollicitudin ut, suscipit a, feugiat et, eros. Vestibulum ac est lacinia nisi venenatis tristique.",5,09/10/2018,Rs.80 Cash Off,Madurai,Q1234:YYPS6T
382,Plajo,image/tiff,Mobiles & Tablets,20,Donec ut mauris eget massa tempor convallis.,1,22/10/2018,FREE,Jabalpur,R8246:I7R0MD
383,Voonder,image/gif,Mobiles & Tablets,57,"Nam ultrices, libero non mattis pulvinar, nulla pede ullamcorper augue, a suscipit nulla elit ac nulla.",2,03/10/2018,40% Discount,Dombivli,H2017:LOAY1W
384,Yakijo,image/tiff,Recharge,25,In blandit ultrices enim.,0,27/10/2018,Rs.300 Cashback,Lucknow,B7380:6FYITQ
385,Skyble,image/pjpeg,Food & Dining,98,"Lorem ipsum dolor sit amet, consectetuer adipiscing elit.",1,07/10/2018,Rs.100 Cash Off,Pune,V7899:FO7EN8
386,Realfire,image/x-tiff,TV/Audio/Video & Movies,16,Nullam porttitor lacus at turpis. Donec posuere metus vitae ipsum.,4,07/10/2018,Rs.400 Cashback,Haora,X9192:H9780X
387,Bubbletube,image/tiff,Recharge,59,Sed accumsan felis.,4,13/10/2018,Rs.300 Cashback,Coimbatore,C1790:ZVKHTX
388,Topiczoom,image/png,Fashion,14,"Cum sociis natoque penatibus et magnis dis parturient montes, nascetur ridiculus mus.",0,21/09/2018,Rs.50 Cashback,Rajkot,W8655:KOYVX5
389,Livepath,image/pjpeg,Mobiles & Tablets,23,"Maecenas tristique, est et tempus semper, est quam pharetra magna, ac consequat metus sapien ut nunc.",4,24/10/2018,Rs.200 Cash Off,Jaipur,K7530:3S8IIG
390,Twimm,image/png,Computers,97,Nullam porttitor lacus at turpis.,3,21/09/2018,90% Discount,Amritsar,G1291:8Q6WJL
391,Tambee,image/x-tiff,Home Furnishing & Decor,40,"Nam dui. Proin leo odio, porttitor id, consequat in, consequat ut, nulla.",4,24/10/2018,Rs.20 Cash Off,Ludhiana,B2460:DD2VU6
392,Buzzbean,image/x-tiff,Computers,83,Donec posuere metus vitae ipsum.,1,12/09/2018,Rs.400 Cashback,Patna,P6440:Z7GLY4
393,Twitterbridge,image/gif,Computers,43,Duis at velit eu est congue elementum.,3,28/10/2018,Rs.90 Cash Off,Lucknow,A5685:IDZZEO
394,Tagtune,image/jpeg,Home Furnishing & Decor,21,Nulla mollis molestie lorem.,3,19/10/2018,Rs.400 Cashback,Pimpri,Q4240:NMV1RI
395,Kanoodle,image/x-tiff,Fashion,40,Aenean sit amet justo. Morbi ut odio.,0,26/10/2018,FREE,Chandigarh,B6606:FGZZI7
396,Gigaclub,image/jpeg,TV/Audio/Video & Movies,19,"Vestibulum quam sapien, varius ut, blandit non, interdum in, ante. Vestibulum ante ipsum primis in faucibus orci luctus et ultrices posuere cubilia Curae; Duis faucibus accumsan odio.",1,27/10/2018,Rs.300 Cash Off,Aurangabad,J8422:GPFDVQ
397,Trudoo,image/tiff,Food & Dining,1,Vestibulum sed magna at nunc commodo placerat.,3,18/09/2018,Rs.400 Cash Off,Chandigarh,Y7492:VKDLB8
398,Kwideo,image/pjpeg,Mobiles & Tablets,31,Nullam porttitor lacus at turpis.,2,29/10/2018,Rs.50 Cash Off,Nowrangapur,N6762:JOC3FZ
399,Twitterlist,image/tiff,Beauty & Health,68,Nulla facilisi. Cras non velit nec nisi vulputate nonummy.,2,15/09/2018,Rs.100 Cash Off,Nashik,Z7781:HQN7FO
400,Linktype,image/x-tiff,Beauty & Health,22,"Fusce lacus purus, aliquet at, feugiat non, pretium quis, lectus. Suspendisse potenti.",0,06/10/2018,Rs.70 Cash Off,Nagpur,R5187:TFIQTG
401,Babbleblab,image/jpeg,Food & Dining,15,Aenean auctor gravida sem.,4,15/10/2018,20% Discount,Varanasi,B6467:U2I86L
402,Quatz,image/pjpeg,Home Furnishing & Decor,53,Sed accumsan felis. Ut at dolor quis odio consequat varius.,5,14/10/2018,Rs.40 Cash Off,Pimpri,R1589:XVPS65
403,Topicblab,image/jpeg,Fashion,51,Suspendisse accumsan tortor quis turpis. Sed ante.,0,08/10/2018,Rs.50 Cash Off,Gwalior,T4183:QUEG2V
404,Oozz,image/gif,Food & Dining,90,"Suspendisse ornare consequat lectus. In est risus, auctor sed, tristique in, tempus sit amet, sem.",4,23/09/2018,Rs.500 Cashback,Amritsar,I3823:1CO055
405,Eadel,image/x-tiff,Beauty & Health,23,Maecenas tincidunt lacus at velit. Vivamus vel nulla eget eros elementum pellentesque.,0,26/09/2018,Rs.90 Cash Off,Vijayawada,F0012:YLX62B
406,Pixoboo,image/jpeg,Food & Dining,79,Morbi a ipsum. Integer a nibh.,3,19/09/2018,Rs.400 Cashback,Nowrangapur,Z6159:T88QFT
407,Zoomzone,image/png,Laptops & Gaming,57,Donec semper sapien a libero.,1,20/10/2018,30% Discount,Allahabad,O0155:SOQ1XP
408,Flashdog,image/pjpeg,Home Furnishing & Decor,38,In congue. Etiam justo.,5,24/09/2018,Rs.200 Cashback,Haora,M4272:TZWV5F
409,Zoomdog,image/jpeg,Beauty & Health,43,Aenean auctor gravida sem. Praesent id massa id nisl venenatis lacinia.,3,16/09/2018,Rs.90 Cash Off,Amritsar,I0880:MMLY3D
410,Katz,image/pjpeg,Computers,34,"Vivamus metus arcu, adipiscing molestie, hendrerit at, vulputate vitae, nisl. Aenean lectus.",0,12/09/2018,40% Discount,Bhopal,T7897:Y347HY
411,Flashpoint,image/pjpeg,Home Furnishing & Decor,9,Sed vel enim sit amet nunc viverra dapibus. Nulla suscipit ligula in lacus.,3,07/10/2018,Rs.60 Cash Off,Coimbatore,B1412:LCD9R0
412,Tazz,image/x-tiff,Beauty & Health,70,Praesent blandit lacinia erat. Vestibulum sed magna at nunc commodo placerat.,1,22/10/2018,Rs.300 Cash Off,Ludhiana,D6243:W8G7V9
413,Tanoodle,image/tiff,TV/Audio/Video & Movies,15,Etiam justo. Etiam pretium iaculis justo.,4,23/09/2018,FREE,Tirunelveli,U0900:DO8AJP
414,Feedfire,image/png,Computers,42,Nam tristique tortor eu pede.,1,24/10/2018,50% Discount,Delhi,D0395:0RK15Z
415,Zoombeat,image/tiff,Computers,94,"Nulla neque libero, convallis eget, eleifend luctus, ultricies eu, nibh. Quisque id justo sit amet sapien dignissim vestibulum.",1,29/09/2018,30% Discount,Dombivli,R0878:VN9RMI
416,Zoomdog,image/jpeg,Food & Dining,35,Ut at dolor quis odio consequat varius.,2,01/10/2018,Rs.200 Cashback,Surat,A1265:CRZ8N1
417,Feedmix,image/x-tiff,TV/Audio/Video & Movies,15,Donec quis orci eget orci vehicula condimentum. Curabitur in libero ut massa volutpat convallis.,4,11/10/2018,Rs.200 Cash Off,Allahabad,E3019:KRDPY3
418,Brainverse,image/jpeg,Entertainment,88,"Cras in purus eu magna vulputate luctus. Cum sociis natoque penatibus et magnis dis parturient montes, nascetur ridiculus mus.",4,27/10/2018,Rs.100 Cashback,Shivaji Nagar,X5062:A6ML3J
419,Katz,image/x-tiff,Fashion,51,Vestibulum ante ipsum primis in faucibus orci luctus et ultrices posuere cubilia Curae; Duis faucibus accumsan odio.,3,21/10/2018,30% Discount,Allahabad,N4270:95CTUY
420,Mydo,image/tiff,Mobiles & Tablets,25,Aenean auctor gravida sem. Praesent id massa id nisl venenatis lacinia.,4,22/09/2018,20% Discount,Jodhpur,O7769:GPIN1T
421,Mybuzz,image/tiff,Mobiles & Tablets,20,Vestibulum sed magna at nunc commodo placerat. Praesent blandit.,0,26/10/2018,Rs.200 Cashback,Jabalpur,Y2319:5WK0DS
422,Riffpath,image/png,Fashion,61,Sed ante.,5,14/09/2018,Rs.20 Cash Off,Thane,M8420:9GYAC3
423,Quimm,image/pjpeg,Food & Dining,45,Suspendisse potenti. Nullam porttitor lacus at turpis.,4,08/10/2018,Rs.100 Cash Off,Jodhpur,W3723:JLE9HD
424,Yakitri,image/gif,TV/Audio/Video & Movies,82,Duis ac nibh.,2,16/09/2018,Rs.70 Cash Off,Pune,Z5798:66LEVK
425,Kimia,image/png,Computers,14,"Integer aliquet, massa id lobortis convallis, tortor risus dapibus augue, vel accumsan tellus nisi eu orci.",0,04/10/2018,Rs.100 Cashback,Pune,A5869:9RPTK6
426,Meejo,image/tiff,Fashion,70,Donec posuere metus vitae ipsum. Aliquam non mauris.,4,09/10/2018,Rs.20 Cash Off,Vadodara,W7460:442O3B
427,Teklist,image/x-tiff,Computers,18,Quisque id justo sit amet sapien dignissim vestibulum. Vestibulum ante ipsum primis in faucibus orci luctus et ultrices posuere cubilia Curae; Nulla dapibus dolor vel est.,2,22/09/2018,90% Discount,Hyderabad,F3714:MBHMKK
428,Yacero,image/png,Computers,1,"Nulla neque libero, convallis eget, eleifend luctus, ultricies eu, nibh. Quisque id justo sit amet sapien dignissim vestibulum.",3,05/10/2018,10% Discount,Kanpur,S3415:7Z6ULQ
429,Gigabox,image/tiff,Fashion,19,Integer tincidunt ante vel ipsum.,0,18/09/2018,Rs.300 Cashback,Madurai,I2026:94CW8S
430,Einti,image/x-tiff,Home Furnishing & Decor,56,Suspendisse potenti. In eleifend quam a odio.,1,23/09/2018,Rs.70 Cash Off,Solapur,M4514:VFIGMM
431,Kaymbo,image/pjpeg,Recharge,29,Pellentesque ultrices mattis odio. Donec vitae nisi.,4,14/09/2018,70% Discount,Chandigarh,C5321:KYSRWD
432,Trudoo,image/x-tiff,Beauty & Health,27,"Duis bibendum, felis sed interdum venenatis, turpis enim blandit mi, in porttitor pede justo eu massa. Donec dapibus.",2,19/09/2018,Rs.50 Cashback,Nagpur,E5165:C4DX93
433,Voonix,image/jpeg,Laptops & Gaming,36,Aenean sit amet justo.,3,23/10/2018,Rs.400 Cash Off,Ludhiana,L5733:IQ9PNQ
434,Skinix,image/jpeg,TV/Audio/Video & Movies,46,Integer ac neque.,0,16/09/2018,Rs.50 Cash Off,Haora,M2768:C2ENIB
435,Riffpath,image/png,TV/Audio/Video & Movies,78,Nulla nisl. Nunc nisl.,2,12/10/2018,Rs.90 Cash Off,Kanpur,C1335:IFV6I5
436,Einti,image/png,Food & Dining,51,Vestibulum ante ipsum primis in faucibus orci luctus et ultrices posuere cubilia Curae; Duis faucibus accumsan odio. Curabitur convallis.,3,12/10/2018,FREE,Dombivli,T4683:49PUXT
437,Brainverse,image/tiff,Laptops & Gaming,79,Sed accumsan felis.,1,20/09/2018,Rs.100 Cashback,Chandigarh,C3384:8UKQ43
438,Layo,image/pjpeg,Mobiles & Tablets,62,Ut tellus. Nulla ut erat id mauris vulputate elementum.,3,29/09/2018,Rs.70 Cash Off,Mumbai,N2889:MM0NTX
439,Trilia,image/pjpeg,Entertainment,32,Nullam molestie nibh in lectus.,2,08/10/2018,Rs.200 Cash Off,Agra,Q2304:N934VK
440,Wordify,image/tiff,Home Furnishing & Decor,74,Vestibulum ante ipsum primis in faucibus orci luctus et ultrices posuere cubilia Curae; Duis faucibus accumsan odio. Curabitur convallis.,4,10/10/2018,Rs.50 Cashback,Meerut,A5444:ZTB2KL
441,Mydo,image/jpeg,Beauty & Health,96,Praesent id massa id nisl venenatis lacinia. Aenean sit amet justo.,1,25/09/2018,Rs.30 Cash Off,Gorakhpur,L0683:WT21PL
442,Tagopia,image/jpeg,Mobiles & Tablets,2,Quisque ut erat.,0,14/09/2018,80% Discount,Jodhpur,K7648:4PAHPK
443,Zoomlounge,image/x-tiff,Laptops & Gaming,57,"Morbi odio odio, elementum eu, interdum eu, tincidunt in, leo. Maecenas pulvinar lobortis est.",0,17/10/2018,FREE,Nowrangapur,K2366:07TTDD
444,Izio,image/png,Home Furnishing & Decor,95,Pellentesque eget nunc. Donec quis orci eget orci vehicula condimentum.,1,23/10/2018,Rs.10 Cash Off,Chennai,H2559:Z74OQU
445,Tagopia,image/gif,Food & Dining,53,Etiam pretium iaculis justo. In hac habitasse platea dictumst.,1,19/09/2018,Rs.400 Cashback,Ghaziabad,D8784:9OF3J4
446,Thoughtbeat,image/pjpeg,Beauty & Health,87,Donec ut mauris eget massa tempor convallis.,3,12/10/2018,Rs.30 Cash Off,Madurai,Q8851:T1NXW0
447,Dabjam,image/x-tiff,Food & Dining,55,Suspendisse potenti.,5,25/09/2018,Rs.40 Cash Off,Lucknow,J7830:W2SJYD
448,Zoomzone,image/x-tiff,Fashion,12,"Donec odio justo, sollicitudin ut, suscipit a, feugiat et, eros. Vestibulum ac est lacinia nisi venenatis tristique.",2,25/10/2018,Rs.80 Cash Off,Chennai,D5630:8E4IW8
449,Jetwire,image/jpeg,Food & Dining,91,Aenean sit amet justo. Morbi ut odio.,5,03/10/2018,Rs.40 Cash Off,Gwalior,Y1932:RL8WXJ
450,Flipopia,image/pjpeg,Fashion,71,Vivamus vel nulla eget eros elementum pellentesque. Quisque porta volutpat erat.,1,13/09/2018,Rs.400 Cash Off,Nowrangapur,K3439:NRMRT7
451,Centidel,image/pjpeg,Mobiles & Tablets,63,"Quisque erat eros, viverra eget, congue eget, semper rutrum, nulla. Nunc purus.",2,16/10/2018,80% Discount,Jabalpur,W2695:4T1S1Z
452,Midel,image/x-tiff,Computers,93,Morbi non lectus.,4,16/09/2018,Rs.500 Cashback,Haora,H1281:VUG6N6
453,Fatz,image/pjpeg,Laptops & Gaming,68,Fusce consequat. Nulla nisl.,5,11/10/2018,50% Discount,Hyderabad,A0595:PO4C0O
454,Brightdog,image/pjpeg,Entertainment,42,Vestibulum sed magna at nunc commodo placerat. Praesent blandit.,2,29/09/2018,Rs.50 Cash Off,Pimpri,N0775:U9SLYT
455,Gevee,image/x-tiff,Entertainment,13,"Mauris enim leo, rhoncus sed, vestibulum sit amet, cursus id, turpis.",4,28/09/2018,Rs.10 Cash Off,Patna,P8907:XE61DL
456,Brightdog,image/tiff,Home Furnishing & Decor,8,Vestibulum ante ipsum primis in faucibus orci luctus et ultrices posuere cubilia Curae; Duis faucibus accumsan odio.,2,11/10/2018,80% Discount,Pune,G2191:LUEQE3
457,Tekfly,image/tiff,Beauty & Health,56,Vestibulum sed magna at nunc commodo placerat. Praesent blandit.,2,22/09/2018,Rs.500 Cash Off,Gwalior,L8672:OD63NM
458,Geba,image/png,Computers,8,Suspendisse potenti.,5,29/09/2018,70% Discount,Nagpur,G6887:GC4X6T
459,Quamba,image/gif,Recharge,89,"Donec diam neque, vestibulum eget, vulputate ut, ultrices vel, augue.",3,13/10/2018,Rs.40 Cash Off,Pimpri,I6695:KBZFAC
460,Jabbertype,image/jpeg,Laptops & Gaming,93,Integer ac leo.,1,17/09/2018,Rs.300 Cash Off,Coimbatore,W7184:8TJAER
461,Nlounge,image/x-tiff,Recharge,12,"Cum sociis natoque penatibus et magnis dis parturient montes, nascetur ridiculus mus.",1,12/10/2018,90% Discount,Nagpur,H5155:Q0Z8ER
462,Mynte,image/tiff,Mobiles & Tablets,6,Mauris ullamcorper purus sit amet nulla.,2,30/10/2018,Rs.50 Cashback,Ahmedabad,M0024:4OQ47U
463,Brightbean,image/jpeg,Home Furnishing & Decor,76,"Morbi sem mauris, laoreet ut, rhoncus aliquet, pulvinar sed, nisl. Nunc rhoncus dui vel sem.",0,29/10/2018,90% Discount,Ahmedabad,J4738:H4C88J
464,Roodel,image/jpeg,Home Furnishing & Decor,2,"Vestibulum ante ipsum primis in faucibus orci luctus et ultrices posuere cubilia Curae; Donec pharetra, magna vestibulum aliquet ultrices, erat tortor sollicitudin mi, sit amet lobortis sapien sapien non mi. Integer ac neque.",1,30/10/2018,Rs.100 Cashback,Patna,V2046:09U82G
465,Realmix,image/png,Home Furnishing & Decor,90,"Integer aliquet, massa id lobortis convallis, tortor risus dapibus augue, vel accumsan tellus nisi eu orci. Mauris lacinia sapien quis libero.",0,01/10/2018,Rs.90 Cash Off,Nagpur,H7035:GY5WDB
466,Midel,image/tiff,Computers,46,Phasellus in felis. Donec semper sapien a libero.,2,20/10/2018,Rs.200 Cash Off,Visakhapatnam,C2784:6ZUU3I
467,Gigabox,image/tiff,TV/Audio/Video & Movies,59,"Donec diam neque, vestibulum eget, vulputate ut, ultrices vel, augue.",4,24/10/2018,60% Discount,Chandigarh,X0586:NZ9QUA
468,Rhybox,image/jpeg,Computers,26,In sagittis dui vel nisl. Duis ac nibh.,2,02/10/2018,90% Discount,Haora,H3881:V3SCGK
469,Rhynyx,image/jpeg,Laptops & Gaming,51,In eleifend quam a odio. In hac habitasse platea dictumst.,5,18/09/2018,Rs.90 Cash Off,Chandigarh,N8575:DVEWNY
470,Youbridge,image/jpeg,Mobiles & Tablets,26,Quisque id justo sit amet sapien dignissim vestibulum. Vestibulum ante ipsum primis in faucibus orci luctus et ultrices posuere cubilia Curae; Nulla dapibus dolor vel est.,3,03/10/2018,30% Discount,Patna,D5675:F2JPDP
471,Avamba,image/gif,Laptops & Gaming,15,Donec quis orci eget orci vehicula condimentum.,4,09/10/2018,Rs.500 Cashback,Pimpri,A2892:OHY8EC
472,Rooxo,image/pjpeg,Laptops & Gaming,24,"Nunc nisl. Duis bibendum, felis sed interdum venenatis, turpis enim blandit mi, in porttitor pede justo eu massa.",4,26/10/2018,Rs.200 Cash Off,Kolkata,M1838:78WWJJ
473,Yambee,image/jpeg,TV/Audio/Video & Movies,71,"Maecenas tristique, est et tempus semper, est quam pharetra magna, ac consequat metus sapien ut nunc.",1,26/10/2018,30% Discount,Madurai,I0317:IZPGVM
474,Buzzbean,image/gif,Beauty & Health,70,Aenean lectus.,3,22/10/2018,70% Discount,Dombivli,T3478:RN2NAM
475,Centizu,image/x-tiff,TV/Audio/Video & Movies,50,"Quisque erat eros, viverra eget, congue eget, semper rutrum, nulla. Nunc purus.",1,19/09/2018,Rs.100 Cash Off,Nowrangapur,D8776:S2V86J
476,Twitterlist,image/png,Computers,10,"Morbi vestibulum, velit id pretium iaculis, diam erat fermentum justo, nec condimentum neque sapien placerat ante.",3,05/10/2018,Rs.200 Cash Off,Ghaziabad,V1803:FN05FQ
477,Yambee,image/jpeg,Computers,47,Integer ac leo.,3,28/09/2018,80% Discount,Dombivli,N3929:F3FF81
478,Thoughtmix,image/x-tiff,Laptops & Gaming,71,In blandit ultrices enim.,2,22/09/2018,Rs.300 Cashback,Jodhpur,K0885:X2UQMW
479,Shufflebeat,image/pjpeg,Recharge,73,"In est risus, auctor sed, tristique in, tempus sit amet, sem. Fusce consequat.",4,30/10/2018,Rs.500 Cash Off,Haora,E1411:JNRUIX
480,Yodo,image/tiff,Food & Dining,45,Nulla ac enim.,3,24/10/2018,Rs.200 Cash Off,Mumbai,Y9143:5YIRU9
481,Feedmix,image/tiff,Laptops & Gaming,62,Nulla tellus.,2,30/09/2018,Rs.300 Cashback,Indore,D0551:XSGTS1
482,Edgetag,image/png,TV/Audio/Video & Movies,46,Nulla justo. Aliquam quis turpis eget elit sodales scelerisque.,2,26/09/2018,Rs.90 Cash Off,Kanpur,K2264:CFGDAI
483,Izio,image/gif,Mobiles & Tablets,46,"Nullam orci pede, venenatis non, sodales sed, tincidunt eu, felis.",2,27/10/2018,40% Discount,Lucknow,V4931:SIN0WU
484,Thoughtsphere,image/png,Fashion,8,Nunc rhoncus dui vel sem. Sed sagittis.,2,24/09/2018,Rs.500 Cashback,Nashik,H1071:6RFAA4
485,Oyonder,image/pjpeg,Entertainment,48,"Fusce congue, diam id ornare imperdiet, sapien urna pretium nisl, ut volutpat sapien arcu sed augue.",4,06/10/2018,20% Discount,Allahabad,X4632:SHK916
486,Buzzdog,image/pjpeg,Food & Dining,17,Etiam pretium iaculis justo.,4,16/10/2018,40% Discount,Delhi,T9359:HZPZXK
487,Kare,image/gif,Home Furnishing & Decor,10,Nulla ut erat id mauris vulputate elementum.,3,23/10/2018,80% Discount,Jodhpur,S9454:61CPPC
488,Feedspan,image/png,Beauty & Health,18,"Fusce posuere felis sed lacus. Morbi sem mauris, laoreet ut, rhoncus aliquet, pulvinar sed, nisl.",1,23/09/2018,Rs.50 Cash Off,Pune,I9142:BVAMCZ
489,Teklist,image/pjpeg,Beauty & Health,7,In eleifend quam a odio. In hac habitasse platea dictumst.,5,04/10/2018,Rs.300 Cashback,Ludhiana,G3797:K4EQSC
490,Kare,image/tiff,Mobiles & Tablets,84,Etiam faucibus cursus urna. Ut tellus.,5,06/10/2018,Rs.50 Cashback,Ludhiana,I1772:RKHOCR
491,Eare,image/gif,Computers,70,"Nullam orci pede, venenatis non, sodales sed, tincidunt eu, felis. Fusce posuere felis sed lacus.",2,11/10/2018,Rs.40 Cash Off,Srinagar,H1301:KLYQAN
492,Livetube,image/jpeg,Beauty & Health,67,"Fusce congue, diam id ornare imperdiet, sapien urna pretium nisl, ut volutpat sapien arcu sed augue.",5,25/09/2018,80% Discount,Kanpur,D5230:NEH1K4
493,Twitterbeat,image/pjpeg,Computers,66,Duis bibendum. Morbi non quam nec dui luctus rutrum.,5,29/09/2018,Rs.80 Cash Off,Nagpur,M8276:411OQ2
494,Meevee,image/png,Recharge,66,"Morbi vel lectus in quam fringilla rhoncus. Mauris enim leo, rhoncus sed, vestibulum sit amet, cursus id, turpis.",4,28/10/2018,30% Discount,Visakhapatnam,F4603:8OIVQ0
495,Youopia,image/gif,TV/Audio/Video & Movies,23,Suspendisse potenti.,1,10/10/2018,Rs.100 Cash Off,Jaipur,M8117:R7QL25
496,Eire,image/x-tiff,Recharge,62,Vivamus in felis eu sapien cursus vestibulum. Proin eu mi.,1,15/10/2018,50% Discount,Jaipur,X8654:9Z719T
497,Realbridge,image/x-tiff,Beauty & Health,22,Nunc purus.,3,21/10/2018,40% Discount,Vadodara,A8232:7IBQA7
498,Wikibox,image/jpeg,Mobiles & Tablets,56,Phasellus in felis. Donec semper sapien a libero.,4,29/10/2018,Rs.200 Cashback,Navi Mumbai,S7037:E1SJ0B
499,Jayo,image/jpeg,Computers,24,In hac habitasse platea dictumst.,1,06/10/2018,40% Discount,Pune,W8879:JDVQK6
